date,ticker,sentiment,relevance,label,headline
2024-01-19,JPM,0.314897,0.626451,Somewhat-Bullish,"BTCO: Convenient, Cost-Effective Avenue to Spot Bitcoin Exposure"
2024-01-21,JPM,0.38195,0.631088,Bullish,S&P 500 Rises as US Stocks Build on Record High: Markets Wrap
2024-01-22,JPM,0.164539,0.603671,Somewhat-Bullish,Palmer Square Capital BDC Inc. Announces Closing of Initial Public Offering
2024-01-22,JPM,0.220627,0.632464,Somewhat-Bullish,Realty Income Closes $9.3B Spirit Capital Acquisition
2024-01-22,JPM,0.225562,0.556639,Somewhat-Bullish,The Future of Customer Interactions in Financial Services - with Ivan Edwards of Cadence Bank and John Thomas of Uniphore
2024-01-23,JPM,0.301811,0.683652,Somewhat-Bullish,15 Top Wealth Creators in the Fund Industry
2024-01-24,JPM,0.142895,0.618491,Neutral,Lynn Song
2024-01-25,JPM,-0.134383,0.584012,Neutral,Charge to replenish FDIC deposit insurance fund costs San Antonio's Frost Bank more than $50 million
2024-01-26,JPM,0.273447,0.729761,Somewhat-Bullish,Exclusive: Morgan Stanley plans to double private credit portfolio to $50 bln
2024-01-26,JPM,-0.234691,0.636004,Somewhat-Bearish,«There’s No White Knight for the Global Economy»
2024-01-29,JPM,-0.327679,0.924848,Somewhat-Bearish,JPMorgan Chase CEO Jamie Dimon says US government debt will lead to market rebellion
2024-01-30,JPM,0.125404,0.643721,Neutral,Investors are making more cross-border money moves
2024-01-31,JPM,-0.138436,0.610052,Neutral,The End of Easy Money
2024-01-31,JPM,0.10325,0.603834,Neutral,"Amer Sports, Inc. Announces Pricing of its Initial Public Offering"
2024-01-31,JPM,0.053305,0.592978,Neutral,Unpopular Magellan ETF reflects investor scepticism in active funds
2024-01-31,JPM,0.245015,0.611059,Somewhat-Bullish,First Citizens’ bold conquest raised the stakes and profile of the family controlled bank
2024-01-31,JPM,0.224676,0.605371,Somewhat-Bullish,Vanguard Debuts Pair of Muni Bond Funds
2024-02-08,JPM,0.072767,0.580014,Neutral,Eaton Vance Launches Active Senior Loan ETF EVLN
2024-02-09,JPM,-0.300994,0.576625,Somewhat-Bearish,"Cambridge, Lincoln among firms hit by SEC's $81M fine blitz"
2024-02-10,JPM,-0.142295,0.582909,Neutral,HYXF - iShares ESG Advanced High Yield Corporate Bond ETF Stock Price and Quote
2024-02-14,JPM,0.02094,0.608892,Neutral,Gerber Kawasaki advisor says a lot of clients are interested in spot bitcoin ETFs
2024-02-15,JPM,0.103395,0.629022,Neutral,Calamos Continues ETF Expansion With CANQ Launch
2024-02-15,JPM,0.147676,0.802979,Neutral,Stock market concentration is on the rise. Will this continue?
2024-02-15,JPM,-0.235918,0.746925,Somewhat-Bearish,The ESG Backlash on Wall Street Spurs a Jump in ETF Closures
2024-02-16,JPM,0.117102,0.369474,Neutral,Morgan Stanley Seeks SEC Approval for Dual Mutual Fund-ETF Share Class
2024-02-19,JPM,0.428516,0.871795,Bullish,Trump Triumph: 7 Stocks to Buy if Republicans Win the Election in 2024
2024-02-19,JPM,-0.066128,0.592741,Neutral,Capital One to acquire Discover Financial
2024-02-20,JPM,0.230512,0.609555,Somewhat-Bullish,Goldman Sachs Boosts Physical Uranium Trades Amid Soaring Prices
2024-02-20,JPM,0.335421,0.643836,Somewhat-Bullish,Passive Gets Active: the Latest ETF Trend
2024-02-22,JPM,0.220662,0.748725,Somewhat-Bullish,Reddit Files Registration Statement for Proposed Initial Public Offering
2024-02-23,JPM,0.11804,0.570675,Neutral,Bitwise stacks up with the biggest players in bitcoin ETF race
2024-02-23,JPM,0.502543,0.633813,Bullish,Episode #522: Wes Gray & Robert Elwood on How to Convert a Separately Managed Account (SMA) to an ETF
2024-02-23,JPM,-0.105381,0.607273,Neutral,Why Allocators Do Badly When Selling Stocks | Chief Investment Officer
2024-02-27,JPM,0.143862,0.64503,Neutral,"Why Bitcoin, Ethereum, and Dogecoin Rallied on Tuesday"
2024-02-27,JPM,0.271886,0.981412,Somewhat-Bullish,TEMIT vs JPMorgan: Which emerging market trust is best?
2024-02-28,JPM,-0.142981,0.621711,Neutral,"With hopes for control shares fading, CEFs eye poison pill strategies"
2024-02-29,JPM,0.109519,0.613555,Neutral,"Exclusive: UK regulators lift punitive capital demands on Nomura, sources say"
2024-03-05,JPM,0.309492,0.834811,Somewhat-Bullish,"Ather IPO: EV maker chooses HSBC, JPMorgan, Nomura, Indian Banks for IPO, aiming for mid-year launch, say sources"
2024-03-06,JPM,0.146783,0.619006,Neutral,Bank CEO sees ‘green shoots’ as more companies talk of going public
2024-03-06,JPM,0.224925,0.607113,Somewhat-Bullish,ALBEMARLE ANNOUNCES UPSIZE AND PRICING OF PUBLIC OFFERING OF DEPOSITARY SHARES
2024-03-07,JPM,0.126089,0.600313,Neutral,MediaAlpha Announces Launch of Secondary Offering
2024-03-07,JPM,0.31059,0.620752,Somewhat-Bullish,Buyers Returning to MBS Market
2024-03-07,JPM,0.343957,0.705436,Somewhat-Bullish,Buyers Returning to MBS Market
2024-03-08,JPM,0.23699,0.577677,Somewhat-Bullish,First Nearshoring EFT Debuts in Mexican Stock Exchange
2024-03-11,JPM,0.128356,0.600885,Neutral,BlackRock hires GSR research analyst who predicted 75% chance of spot ether ETF approval by May
2024-03-13,JPM,0.428467,1.0,Bullish,JPMorgan Taps Global X's Jon Maier as Chief ETF Strategist
2024-03-13,JPM,0.248331,0.926095,Somewhat-Bullish,In the Market: Bid to end bank 'window dressing' may reshape US repo market
2024-03-13,JPM,0.324278,0.622042,Somewhat-Bullish,European banks' bumpy recovery a year after Credit Suisse collapse
2024-03-14,JPM,-0.400112,1.0,Bearish,JPMorgan fined nearly $350 million for inadequate trade reporting
2024-03-14,JPM,-0.645747,1.0,Bearish,JPMorgan Chase Fined $250m for Trade Surveillance Failure
2024-03-15,JPM,0.238974,0.642348,Somewhat-Bullish,3 Stocks That Have Paid Dividends for Over 100 Years
2024-03-15,JPM,0.123087,0.637121,Neutral,BlackRock launches U.S. equity ETFs with covered-call strategies as option-based funds surge
2024-03-15,JPM,0.246333,0.638823,Somewhat-Bullish,BlackRock launches U.S. equity ETFs with covered-call strategies as option-based funds surge
2024-03-15,JPM,0.22344,0.644754,Somewhat-Bullish,BlackRock launches U.S. equity ETFs with covered-call strategies as option-based funds surge
2024-03-15,JPM,0.103147,0.60935,Neutral,BlackRock launches U.S. equity ETFs with covered-call strategies as option-based funds surge
2024-03-15,JPM,0.247765,0.646388,Somewhat-Bullish,BlackRock launches U.S. equity ETFs with covered-call strategies as option-based funds surge
2024-03-18,JPM,0.317854,0.629857,Somewhat-Bullish,MGV: Large Value Makes More Sense Now
2024-03-19,JPM,0.339128,0.615727,Somewhat-Bullish,Bryan Armour: Is Index Investing’s Superpower Unstoppable?
2024-03-20,JPM,0.121394,0.562593,Neutral,Advisors may want to up their emerging market bond allocations
2024-03-21,JPM,0.306015,0.617687,Somewhat-Bullish,Emerging Market Opportunities Outside of China: Views From the Middle East
2024-03-22,JPM,0.120187,0.571447,Neutral,"BlackRock's Fink deserves a standing ovation, Galaxy Digital CEO says"
2024-03-23,JPM,0.321304,0.646954,Somewhat-Bullish,Des performances annuelles au-delà des 10 % pour les meilleurs fonds obligataires datés
2024-03-25,JPM,0.219537,0.649845,Somewhat-Bullish,Morgan Stanley’s ETFs Break $1 Billion With Mutual Fund Flips
2024-03-26,JPM,-0.200406,0.635698,Somewhat-Bearish,Wave of Property-Loan Maturities Amplified by Extensions
2024-03-26,JPM,0.113837,0.601154,Neutral,What could spark the next stock-market selloff? Here’s what history tells us.
2024-03-26,JPM,0.315842,0.816714,Somewhat-Bullish,Indian bonds are set to be added to global indexes. Here's why it could be a gamechanger
2024-03-26,JPM,0.142408,0.56719,Neutral,Pummeled Blackstone Real Estate Unit Seems Poised for a Revival
2024-03-26,JPM,0.293662,0.600731,Somewhat-Bullish,"BlackRock is UK's top performing fund brand, according to 2024 Broadridge Fund Brand 50 Report"
2024-03-29,JPM,0.43471,0.638193,Bullish,Asur y Kimberly Clark tienen los dividendos más atractivos de la BMV: Valmex
2024-04-03,JPM,0.235143,0.572613,Somewhat-Bullish,"Copel: Radar Gestora reduz participação para 4,98%das ações PNB"
2024-04-03,JPM,0.099597,0.559329,Neutral,What is the ARK 21Shares ARKB spot bitcoin ETF?
2024-04-05,JPM,0.144275,0.612641,Neutral,"BlackRock Adds Goldman Sachs, Citigroup, UBS as APs for Bitcoin ETF"
2024-04-05,JPM,0.142605,0.641391,Neutral,"Treasury Yields Snapshot: April 5, 2024"
2024-04-08,JPM,0.121369,0.604801,Neutral,"VOOV: A Decent Passively Managed Value ETF, But Not The Best (NYSEARCA:VOOV)"
2024-04-10,JPM,0.236018,0.597019,Somewhat-Bullish,Parametric避險股票主動型ETF-PHEQ-ETF基本資料
2024-04-10,JPM,0.328329,0.603054,Somewhat-Bullish,Is Now a Good Time to Invest in Oil Stocks?
2024-04-11,JPM,-0.148649,0.602911,Neutral,Nuveen Announces Closing of $1.25 Billion Senior Notes Offering
2024-04-11,JPM,-0.346928,0.630111,Somewhat-Bearish,"Latest: Korea’s FSS to release ELS inspections reports, sanctions framework"
2024-04-13,JPM,0.306166,0.6294,Somewhat-Bullish,ETF de Bitcoin da BlackRock é o 3º mais investido por brasileiros no exterior
2024-04-15,JPM,0.023801,0.556726,Neutral,VIDEO: ETF of the Week: Invesco Senior Loan ETF (BKLN)
2024-04-15,JPM,-0.114144,0.621945,Neutral,Goldman posts stronger-than-expected Q1 results
2024-04-15,JPM,0.141576,0.64807,Neutral,Schwab Q1 revenue tops estimates
2024-04-16,JPM,0.102841,0.619507,Neutral,BNY Mellon quarterly results top Wall St estimates on higher services fees
2024-04-16,JPM,0.08847,0.590283,Neutral,Southwest Gas To Carve Out Centuri In IPO
2024-04-17,JPM,0.077315,0.567041,Neutral,"As other banks report decline in deposits, Minneapolis-based U.S. Bancorp experiencing a surge"
2024-04-17,JPM,-0.279965,0.637786,Somewhat-Bearish,What’s the Deal With the Bitcoin Halving?
2024-04-18,JPM,0.127838,0.732103,Neutral,Citizens Financial is latest lender to tap the bond market a day after earnings
2024-04-18,JPM,0.10454,0.632741,Neutral,Invesco’s Justin Danfield on Risk Mitigation for Bond Investing
2024-04-22,JPM,0.212174,0.621367,Somewhat-Bullish,"HEDGE FLOW Hedge fund borrowing hits five-year peak, Goldman Sachs says"
2024-04-22,JPM,0.212705,0.672281,Somewhat-Bullish,BlackRock set for first mutual fund-to-ETF switch
2024-04-23,JPM,0.339792,0.612376,Somewhat-Bullish,"삼성자산운용, SOFR ETF로 美 뉴욕거래소 상장기념식 참석"
2024-04-23,JPM,0.001244,0.629533,Neutral,"Goldman and BofA face renewed calls to split CEO, chairman's roles"
2024-04-23,JPM,0.39008,0.642447,Bullish,"美증시 '오프닝 벨' 울린 삼성운용…서봉균 ""한국 금융 글로벌 위상 높일 것"""
2024-04-25,JPM,0.308417,0.588695,Somewhat-Bullish,"Experience real-time quotes, in-depth charts, and analyst ratings"
2024-04-26,JPM,0.238223,0.629199,Somewhat-Bullish,Above the Noise: Is inflation obsession overblown?
2024-04-29,JPM,-0.144084,0.630704,Neutral,"High interest rates will continue to dampen deals, Frost Bank CEO says"
2024-04-30,JPM,0.307304,0.604311,Somewhat-Bullish,Korea’s Kookmin Bank raises $600 mn in global senior debts
2024-04-30,JPM,0.065945,0.555695,Neutral,3 Tips When Looking to Short-Term Bonds
2024-04-30,JPM,0.143042,0.581002,Neutral,The Potential Rate Cut Benefits for Short Duration Bonds
2024-05-01,JPM,0.109379,0.628068,Neutral,Expert Investors: ETFs key for tactical allocations in government bonds
2024-05-03,JPM,0.144554,0.734343,Neutral,Mister Car Wash upgraded to overweight by JPMorgan while Driven Brands gets cut
2024-05-06,JPM,0.29162,0.624275,Somewhat-Bullish,Five funds outpacing the Hong Kong stock market rally
2024-05-07,JPM,0.436891,0.895565,Bullish,JPMorgan (JPM) to Recognize $8B Gain From Visa Share Exchange
2024-05-07,JPM,0.149382,0.600158,Neutral,2024 Credit Market Outlook
2024-05-08,JPM,0.125805,0.642317,Neutral,"The market's attention is focused after Stanley Druckenmiller, a Wall Street billionaire investor, b.."
2024-05-08,JPM,0.21986,0.842593,Somewhat-Bullish,Wells Fargo names former JPMorgan executive as co-head of investment bank
2024-05-08,JPM,0.107178,0.612658,Neutral,Katie Stockton
2024-05-08,JPM,-0.098143,0.643327,Neutral,BlackRock ETF Flash Crash in Europe Explained
2024-05-09,JPM,0.057667,0.574766,Neutral,WisdomTree’s Crypto Business Goes Live in New York Against Big Shareholder's Wishes
2024-05-10,JPM,0.341382,0.646539,Somewhat-Bullish,Active ETF Investors Flock to DFA Funds
2024-05-13,JPM,0.316056,0.638493,Somewhat-Bullish,ON THE MOVE: FalconX Hires Jonathan Yam; Tom Holmes to KeyBanc Capital Markets
2024-05-14,JPM,0.23582,0.677753,Somewhat-Bullish,"Emmanuel Macron woos Wall Street as he tries to position Paris as Europe’s top financial hub, calling Basel banking regulations 'a killer for risk taking'"
2024-05-16,JPM,0.243665,0.618773,Somewhat-Bullish,Goldman Sachs Wins $43.4 Billion UPS Deal
2024-05-16,JPM,0.304117,0.906399,Somewhat-Bullish,"Soros Fund Management dissolves NYCB stake, adds Goldman Sachs, JPMorgan in first quarter"
2024-05-17,JPM,0.255908,0.558665,Somewhat-Bullish,"Regulatory Risks, Investment Sentiment and the India/Bharat Conundrum"
2024-05-17,JPM,0.244017,0.828476,Somewhat-Bullish,J.P. Morgan Asset Management Launches Active Developing Markets Equity ETF: JADE
2024-05-17,JPM,0.144258,0.613706,Neutral,How to immunize your bond ETF if interest rates turn back up
2024-05-17,JPM,-0.146418,0.635088,Neutral,How to immunize your bond ETF if interest rates turn back up
2024-05-17,JPM,0.33109,0.71695,Somewhat-Bullish,JPMorgan's New JADE ETF Highlights Emerging Markets
2024-05-19,JPM,0.294707,0.625614,Somewhat-Bullish,3 High-Yield Dividend ETFs to Buy to Generate Passive Income
2024-05-21,JPM,0.13566,0.631161,Neutral,MasterBrand acquires Supreme Cabinetry Brands for $520 million
2024-05-23,JPM,-0.246424,0.617337,Somewhat-Bearish,Sinking volatility rings cross-asset complacency warning
2024-05-28,JPM,0.138414,0.58113,Neutral,Morning Copper Markets
2024-05-28,JPM,0.003498,0.710208,Neutral,BALI: Can BlackRock’s 8.14% Yielding ETF Help You Retire In Bali?
2024-05-29,JPM,0.409439,0.947806,Bullish,3 Banks Stocks to Outperform the S&P 500 Through 2030
2024-05-29,JPM,0.220331,0.701496,Somewhat-Bullish,BlackRock's $20 Billion ETF becomes world’s biggest bitcoin fund
2024-06-05,JPM,0.332066,0.629453,Somewhat-Bullish,"Clean Energy ETFs Rebound on China, U.S. Windfall"
2024-06-06,JPM,-0.131742,0.62642,Neutral,Texas is coming for Wall Street with a new BlackRock-backed stock exchange
2024-06-07,JPM,0.138843,0.612193,Neutral,Waystar Shares Dip After 2024’s Biggest IPO by a US Company
2024-06-07,JPM,0.238658,0.631208,Somewhat-Bullish,"0DTE Options Volume, Penny Stocks, Panic Buying in Stocks"
2024-06-10,JPM,0.311881,0.97885,Somewhat-Bullish,2024 Mid-Year Outlook: Key Takeaways
2024-06-10,JPM,0.14574,0.640632,Neutral,Ferguson plc: Share Repurchase Program
2024-06-11,JPM,0.125733,0.649026,Neutral,The value of securities lending in three charts
2024-06-12,JPM,0.12031,0.600875,Neutral,"National Grid Results of Rights Issue June 12, 2024"
2024-06-12,JPM,0.208305,0.612019,Somewhat-Bullish,Eni sells 10% of Saipem at 1.970 euros per share
2024-06-13,JPM,0.439295,1.0,Bullish,J.P. Morgan Life Sciences Private Capital Closes Inaugural Biotechnology Venture Capital Fund with over $500 million in Commitments
2024-06-13,JPM,0.415479,0.975142,Bullish,Active ETFs take centre stage
2024-06-13,JPM,0.108133,0.632204,Neutral,"With 84% ownership of the shares, Cadence Bank (NYSE:CADE) is heavily dominated by institutional owners"
2024-06-15,JPM,0.208437,0.63189,Somewhat-Bullish,Best Bank ETFs
2024-06-15,JPM,0.300459,0.603906,Somewhat-Bullish,This ETF strategy may help investors skirt market concentration risk
2024-06-17,JPM,0.322344,0.617343,Somewhat-Bullish,MSCI Inc. appoints new Global Controller and CAO
2024-06-17,JPM,0.129344,0.579,Neutral,"Ag Plus, Inc. -"
2024-06-17,JPM,0.249907,0.623061,Somewhat-Bullish,Naver's Webtoon Entertainment aims up to $2.67 bln valuation in US IPO
2024-06-17,JPM,0.211601,0.613498,Somewhat-Bullish,LandBridge Announces Launch of IPO
2024-06-18,JPM,0.112351,0.60589,Neutral,Redwood Trust to close $85M in debt offering
2024-06-18,JPM,0.187553,0.687186,Somewhat-Bullish,"UBS, HSBC tap Euroclear Bank, HKMA for cross-border RMB repo"
2024-06-19,JPM,0.146119,0.61162,Neutral,Regional Banks Want to Slim Down. Hedge Funds Smell a Bargain.
2024-06-20,JPM,0.140107,0.645118,Neutral,PENN Shares Spike On Potential Acquisition Bid By Boyd Gaming
2024-06-21,JPM,-0.136291,0.635052,Neutral,M&T Bank taking offers on ‘non-performing’ $31M loan backed by major Class A New Haven office tower
2024-06-24,JPM,0.34944,0.644764,Somewhat-Bullish,"Prestige Estates taps Kotak, JPM, JM Fin and CLSA for Rs 5,000-crore QIP; launch likely in July-Aug"
2024-06-24,JPM,0.234681,0.989036,Somewhat-Bullish,Sustainable ETFs: A Polarized Global Market with Europe as the Leading Region
2024-06-25,JPM,0.383991,0.885292,Bullish,"Explained: India inclusion in JP Morgan EM Bond index, market impact & more"
2024-06-27,JPM,0.121001,0.64729,Neutral,Naver's webtoon unit to raise $315 mn via Nasdaq IPO
2024-06-27,JPM,0.205597,0.839742,Somewhat-Bullish,Bond market: Why foreign funds are flocking to India despite entry barriers
2024-06-27,JPM,0.223643,0.636839,Somewhat-Bullish,Capital Group launches seven active ETFs
2024-06-27,JPM,0.275722,0.581084,Somewhat-Bullish,South Korea-Owned Webtoon Launches Its Nasdaq IPO
2024-06-28,JPM,0.26944,0.643549,Somewhat-Bullish,"AI demand for data centers boosts Digital Realty’s prospects, stock wins upgrade"
2024-06-28,JPM,0.27626,0.603158,Somewhat-Bullish,"AI demand for data centers boosts Digital Realty’s prospects, stock wins upgrade"
2024-07-10,JPM,0.325958,0.646251,Somewhat-Bullish,"This Semiconductor Stock Under $50 Is an AI Winner, Says JPMorgan"
2024-07-11,JPM,0.41687,0.936844,Bullish,e-FX awards 2024: The winners
2024-07-15,JPM,0.114375,0.640907,Neutral,Cleveland-Cliffs to Buy Canada’s Stelco for $2.8 Billion
2024-07-15,JPM,0.145777,0.705102,Neutral,Goldman Sachs posts earnings beat as traders outpace estimates
2024-07-15,JPM,0.347363,0.602611,Somewhat-Bullish,Five top European equity funds year-to-date
2024-07-16,JPM,0.305554,0.638621,Somewhat-Bullish,Bank of America shares jump 5% after saying net interest income rebound is coming
2024-07-16,JPM,0.147961,0.705617,Neutral,BofA eyes its 1st Korean IPO management with K Bank deal
2024-07-16,JPM,0.331772,0.607552,Somewhat-Bullish,Morgan Stanley Stock Jumps After Better-Than-Expected Q2 Earnings
2024-07-16,JPM,0.111598,0.582254,Neutral,Alpha Cognition upgraded at Raymond James
2024-07-16,JPM,0.127018,0.571809,Neutral,Balance Longer Duration With EVSD While Capturing Income
2024-07-16,JPM,0.344508,0.717387,Somewhat-Bullish,8 of the Best International Fund Managers
2024-07-17,JPM,0.262809,0.64811,Somewhat-Bullish,"Societe Generale, Morgan Stanley and others buy Zomato shares worth Rs 635 crore via block deals"
2024-07-17,JPM,-0.317165,0.64993,Somewhat-Bearish,"Five Below Stock Tumbles on CEO Departure, Lowered Guidance"
2024-07-18,JPM,0.327372,0.625358,Somewhat-Bullish,Wall Street Senses the Barbarians Are Finally at the Gates
2024-07-18,JPM,0.282672,0.603927,Somewhat-Bullish,Lazard AM makes the case for emerging markets
2024-07-19,JPM,0.091732,0.640417,Neutral,Warren Buffett's Recent Reduction in Bank of America Holdings
2024-07-22,JPM,0.14496,0.60373,Neutral,Ethereum ETFs May See ‘Lower-Than-Anticipated Demand’: Report
2024-07-23,JPM,0.087544,0.584081,Neutral,Travelers Stock Was Down 8% In A Day. Why?
2024-07-24,JPM,0.134902,0.602506,Neutral,"Riskified To Report Second Quarter 2024 Financial Results on Wednesday, August 14"
2024-07-24,JPM,0.259124,0.615792,Somewhat-Bullish,Transportadora de Gas del Sur S.A.’s $490 Million Global Bond Offering and Concurrent Tender Offer
2024-07-26,JPM,0.2628,0.583732,Somewhat-Bullish,Small Caps Are Positioned to Benefit From Falling Rates
2024-07-28,JPM,-0.225182,0.611809,Somewhat-Bearish,6 major banks settle for $80 million in European bond-rigging allegations - Business & Economy News
2024-07-29,JPM,0.325199,0.924881,Somewhat-Bullish,JPMorgan And Warren Buffett's Favorite Stock Share These Traits
2024-07-29,JPM,0.118986,0.625351,Neutral,Eastman Announces Cash Tender Offer to Purchase its 3.800% Notes due 2025
2024-07-30,JPM,0.14107,0.588196,Neutral,"As Gold Prices Climb, Miners Are Offering Incredible Value"
2024-08-01,JPM,0.214585,0.647728,Somewhat-Bullish,Calamos Launches CPSA With 100% Downside Protection to S&P 500
2024-08-01,JPM,0.254428,0.707188,Somewhat-Bullish,Global issuers turn to Dim Sum bonds to lower financing costs
2024-08-09,JPM,0.418253,0.739867,Bullish,JPMorgan Asset Management Launches Fundamental Data Science ETF Suite on Nasdaq
2024-08-12,JPM,0.327055,0.64803,Somewhat-Bullish,Investment funds pour into Australian banks; caution on miners
2024-08-12,JPM,0.149709,0.612107,Neutral,Scotiabank to buy almost 15% of KeyCorp for about $2.8 billion
2024-08-13,JPM,0.265369,0.897138,Somewhat-Bullish,JP Morgan launches active ETFs driven by data science
2024-08-14,JPM,0.144858,0.624331,Neutral,"1,000% stock increase: The story behind Eli Lilly’s pharmaceutical dominance"
2024-08-14,JPM,0.121205,0.61284,Neutral,Rockefeller crashes the high-yield muni bond party with new ETFs
2024-08-14,JPM,0.330533,0.629466,Somewhat-Bullish,BlackRock iShares Bitcoin Trust Breaks ETF Chart With $20 Billion Inflow
2024-08-14,JPM,0.106567,0.89334,Neutral,Scotiabank adds JPMorgan exec in warehouse lending expansion
2024-08-15,JPM,0.32994,0.617021,Somewhat-Bullish,"Capula, Schonfeld, Point72 among hedge funds riding bitcoin ETFs"
2024-08-15,JPM,-0.425492,0.628833,Bearish,"TD, BNY, Truist hit with WhatsApp penalties"
2024-08-16,JPM,0.140406,0.619534,Neutral,"Fidelity Eyes Stablecoins, Tokenised Treasuries in Crypto Push"
2024-08-16,JPM,0.08098,0.629618,Neutral,Gates Industrial (GTES) Prices Secondary Offering Of 20M Ordinary Shares
2024-08-16,JPM,-0.081167,0.591397,Neutral,"Intercontinental Exchange Stock Gained 22% YTD, What’s Next?"
2024-08-19,JPM,0.126398,0.637998,Neutral,Realty Income Successfully Prices $500 Million Offering of Senior Notes Due 2054
2024-08-19,JPM,0.000569,0.643318,Neutral,Marriott Drops Sonder a Lifeline
2024-08-19,JPM,0.317285,0.633277,Somewhat-Bullish,JBND: New Active Bond ETF From JPMorgan (NYSE:JBND)
2024-08-20,JPM,0.211412,0.610545,Somewhat-Bullish,Job Market Holds Key to U.S. Economy’s Future
2024-08-20,JPM,0.184664,0.568901,Somewhat-Bullish,2024 Mid-year Investing Picks
2024-08-20,JPM,0.105605,0.631482,Neutral,2024 PLANADVISER DCIO Survey
2024-08-26,JPM,0.13579,0.630833,Neutral,HSBC Targets To Double Wealth Business Assets To $131B In UK: Report
2024-08-26,JPM,0.335079,0.631715,Somewhat-Bullish,U.S. Bancorp (USB) Rises 12% in 3 Months: More Upside Left?
2024-08-27,JPM,0.110839,0.615668,Neutral,"3 Cruise Line Stocks Promising Near-Term Growth: RCL, CCL, NCLH"
2024-08-27,JPM,0.014225,0.645583,Neutral,BofA clients pull out of US stocks as S&P 500 hovers near all-time high
2024-08-29,JPM,0.100858,0.601368,Neutral,Harbor Capital Advisors Expands Growing ETF Lineup with the Harbor Active Small Cap ETF
2024-08-29,JPM,0.14219,0.560552,Neutral,"GigCapital7 Corp. Announces Pricing of $200,000,000 Initial Public Offering"
2024-08-30,JPM,0.125361,0.618248,Neutral,Solid-State EV Batteries Could Drive Silver Demand: How to Invest
2024-08-30,JPM,0.194807,0.701605,Somewhat-Bullish,"Mike Philbrick's Top Picks:iShares Gold Bullion ETF, TD Q U.S. Small-Mid-Cap Equity ETF, and iMGP DBi Managed Futures Strategy ETF."
2024-08-30,JPM,0.315383,0.624601,Somewhat-Bullish,"Smallcaps, infra, PSU mutual funds make investors richer with 30% CAGR in 5 years"
2024-08-30,JPM,0.310568,0.55809,Somewhat-Bullish,Looming Rate Cuts Could Push These ETFs Higher
2024-09-12,JPM,-0.104579,0.618593,Neutral,Acciones argentinas volaron en Wall Street: cuál subió más
2024-09-12,JPM,0.115679,0.635351,Neutral,Kazakh giant eyes Hong Kong’s dim sum bonds to fund cable project
2024-09-12,JPM,0.26274,0.574986,Somewhat-Bullish,BlackRock Inc. Expands Stake in Louisiana-Pacific Corp
2024-09-13,JPM,0.266307,0.639756,Somewhat-Bullish,Lazard Asset Management launches listed private markets fund
2024-09-16,JPM,0.140833,0.590808,Neutral,Money losing natgas producer BKV revives US IPO
2024-09-16,JPM,-0.14813,0.638087,Neutral,Los ADR del Grupo Aval y Ecopetrol fueron los que más cayeron en la última década
2024-09-17,JPM,0.319551,0.615672,Somewhat-Bullish,Investors Bet on Emerging Market Bonds Amid Fed Rate Cut Expectations
2024-09-17,JPM,0.144145,0.708073,Neutral,Casella Waste Systems Announces Proposed Public Offering of Class A Common Stock
2024-09-17,JPM,0.00918,0.700978,Neutral,Citigroup undeterred by fossil fuel protests
2024-09-17,JPM,0.200408,0.603971,Somewhat-Bullish,"CLO ETFs in Focus: Virtus, Blondbloxx, Nuveen Plot Entrance"
2024-09-18,JPM,0.323023,0.631045,Somewhat-Bullish,YPF emite obligaciones negociables Clase XXXI por US$ 500 millones
2024-09-18,JPM,0.116036,0.629591,Neutral,Who Owns DraftKings?
2024-09-19,JPM,0.418017,0.62381,Bullish,South Korean investors bet big on ETFs tracking Indian equities
2024-09-24,JPM,0.235335,0.627665,Somewhat-Bullish,"HDFC Bank plans to offload ₹70,000cr loan assets, shares surge"
2024-09-24,JPM,0.110772,0.627015,Neutral,"Goldman Sachs Group, Inc. (NYSE:GS): Here is What Jim Cramer’s Looking At"
2024-09-24,JPM,0.234139,0.590851,Somewhat-Bullish,What does AI-driven stock selection mean for passive investors?
2024-09-24,JPM,-0.127995,0.644919,Neutral,"Ankur Crawford: ‘When Software Begins to Write Software, Innovation Is Exponential’"
2024-09-25,JPM,0.329497,0.617049,Somewhat-Bullish,Private Credit: Opportunities and Challenges for Businesses in Italy
2024-09-25,JPM,0.080686,0.56277,Neutral,Pase del CEO de Macro a Supervielle reaviva rumores de M&A en el mercado argentino
2024-09-25,JPM,0.10051,0.590721,Neutral,"With Uncertainty Ahead, Intermediate Bonds Offer Opportunities"
2024-09-26,JPM,-0.102767,0.618672,Neutral,Wells Fargo Sends Fed a Crucial Review for Lifting Asset Cap
