date,ticker,sentiment,relevance,label,headline
2024-07-01,MSFT,0.244593,0.637224,Somewhat-Bullish,Active investing is suited to the uncertain markets ahead
2024-07-01,MSFT,0.116404,0.61186,Neutral,5 Stocks to Buy for 3Q 2024
2024-07-11,MSFT,0.208321,0.601726,Somewhat-Bullish,Jim Cramer Calls ServiceNow (NOW) Analyst Downgrade a ‘Heresy’
2024-07-11,MSFT,0.31836,0.629675,Somewhat-Bullish,Value investors cooling their heels as growth stocks stay hot
2024-07-15,MSFT,0.487142,1.0,Bullish,"Wells Fargo Maintains Microsoft(MSFT.US) With Buy Rating, Raises Target Price to $600"
2024-07-16,MSFT,0.118922,0.649537,Neutral,Apple at all-time high after Morgan Stanley calls stock 'top pick' for AI efforts
2024-07-18,MSFT,-0.113965,0.711878,Neutral,Can Value Stocks Really Make a Comeback?
2024-07-18,MSFT,0.257439,0.585756,Somewhat-Bullish,Infosys Stock Soars After Company Raises Outlook as AI Demand Drives IT Spending
2024-07-18,MSFT,0.414367,0.858386,Bullish,3 Evergreen Stocks to Buy for an Easier Retirement
2024-07-19,MSFT,-0.240757,0.713486,Somewhat-Bearish,Quem é a CrowdStrike e qual a relação com o apagão que derrubou sistemas no mundo?
2024-07-20,MSFT,0.328137,0.647774,Somewhat-Bullish,"KraneShares Artificial Intelligence and Technology ETF ETF Price, Holdings, & News (NASDAQ:AGIX)"
2024-07-22,MSFT,-0.313813,0.702331,Somewhat-Bearish,Delta and United's hub-and-spoke model largely to blame for continued delays (DAL)
2024-07-22,MSFT,-0.244411,0.714652,Somewhat-Bearish,Solar R&D innovation center advances PV technology
2024-07-23,MSFT,0.330417,0.55897,Somewhat-Bullish,3 ETFs That Are Outperforming the S&P 500
2024-07-23,MSFT,0.202362,0.624557,Somewhat-Bullish,Top 3 Digital Advertising Stocks for Your July Buy List
2024-07-23,MSFT,0.330199,0.641657,Somewhat-Bullish,ACVF - Meritocracy Trumps DEI Conservative Values Fund buys Deere and Tractor Supply liquidates Chipotle
2024-07-25,MSFT,-0.302693,0.608772,Somewhat-Bearish,"Tesla, Google Spark Sell-Off in Technology ETFs"
2024-07-30,MSFT,0.001764,0.92882,Neutral,Opinion: Microsoft and AMD earnings show that AI remains a game of optics
2024-07-30,MSFT,0.04973,0.72282,Neutral,Opinion: Microsoft and AMD earnings show that AI remains a game of optics
2024-07-31,MSFT,0.338278,0.686505,Somewhat-Bullish,Invest Like Congress: 2 ETFs to Add to Your Watchlist
2024-07-31,MSFT,0.139565,0.746849,Neutral,Is There Value In Small Cap Value Versus Large Cap Growth
2024-08-09,MSFT,0.322641,0.646385,Somewhat-Bullish,Should Vanguard Russell 1000 Growth ETF (VONG) Be on Your Investing Radar?
2024-08-11,MSFT,-0.22304,0.638254,Somewhat-Bearish,Why is NICE’s share price tumbling?
2024-08-12,MSFT,0.307503,0.622475,Somewhat-Bullish,3 Principal Financial Group Mutual Fund for Strong Returns
2024-08-13,MSFT,0.123271,0.647756,Neutral,"John Zechner's Past Picks: Rogers Communications, Pembina Pipeline, and BRP"
2024-08-13,MSFT,0.103558,0.602907,Neutral,Growth Beats Yield at This T. Rowe Price Mutual Fund
2024-08-13,MSFT,0.314118,0.600309,Somewhat-Bullish,Humanoid Helpers of the Future
2024-08-15,MSFT,0.312966,0.616864,Somewhat-Bullish,IUSG: A Growth ETF With An Impressive 12% IRR Potential (NASDAQ:IUSG)
2024-08-16,MSFT,0.264217,0.56781,Somewhat-Bullish,Welche KI-Aktien-ETFs sind interessant?
2024-08-16,MSFT,0.305191,0.74854,Somewhat-Bullish,Lumen Stock Has Been on a Wild Ride. Is It a Buy?
2024-08-19,MSFT,0.207879,0.624244,Somewhat-Bullish,AMD to acquire server builder ZT Systems for $4.9 billion in cash and stock
2024-08-19,MSFT,0.344217,0.648072,Somewhat-Bullish,"DevSecOps Market Insights Discussed Regarding Size, Share And Outlook 2024"
2024-08-21,MSFT,0.290457,0.60811,Somewhat-Bullish,AI Stock Eyes Early Buy Trigger As Profits Surge
2024-08-22,MSFT,0.335572,0.64347,Somewhat-Bullish,"Amplify CWP Growth & Income ETF ETF Price, Holdings, & News (NYSEARCA:QDVO)"
2024-08-22,MSFT,0.111952,0.622075,Neutral,Amplify CWP Growth & Income ETF Holdings
2024-08-22,MSFT,0.293145,0.617532,Somewhat-Bullish,"Going into earnings, is Nvidia stock a buy, a sell, or fairly valued?"
2024-08-22,MSFT,0.301821,0.632095,Somewhat-Bullish,Palo Alto Networks’ Growth Soars due to High Cybersecurity Demand
2024-08-23,MSFT,0.015617,0.729645,Neutral,QDVO Top Holdings List & Exposure (Amplify CWP Growth & Income ETF)
2024-08-26,MSFT,0.344125,0.636397,Somewhat-Bullish,Stay Flexible With the AI Trade With These 2 ETFs
2024-08-26,MSFT,0.352965,0.636923,Bullish,Joel Greenblatt – Top 10 Holdings – Latest 13F
2024-08-26,MSFT,0.329576,0.64142,Somewhat-Bullish,What if Nvidia Misses Earnings?
2024-08-27,MSFT,-0.138584,0.805095,Neutral,IBM Is America’s Worst Big Tech Company
2024-08-27,MSFT,0.457622,0.871027,Bullish,3 Dividend-Growth Stocks That a Top-Rated Vanguard Fund Manager Likes
2024-08-27,MSFT,-0.145121,0.625706,Neutral,Immersion Stock Surges as It Monetizes Haptic Technology Patents
2024-08-28,MSFT,0.113843,0.581474,Neutral,Berkshire Just Crossed $1 Trillion. Is It a Buy?
2024-08-29,MSFT,0.183833,0.720432,Somewhat-Bullish,Intuit: A Mini-Microsoft In The Making? (NASDAQ:INTU)
2024-08-29,MSFT,0.118069,0.646227,Neutral,Warren Buffett's Berkshire Hathaway is Worth $1 Trillion. Should I Buy Shares?
2024-08-30,MSFT,0.133451,0.610884,Neutral,Intapp director Ralph Baxter sells over $1.35m in company stock
2024-09-12,MSFT,0.028447,0.667301,Neutral,Should TCW Transform 500 ETF (VOTE) Be on Your Investing Radar?
2024-09-16,MSFT,0.466179,1.0,Bullish,Microsoft announces quarterly dividend increase and new share repurchase program
2024-09-17,MSFT,0.134021,0.604214,Neutral,SHÁKA RASHEED JOINS OPEN OPPORTUNITY FUND AS GENERAL PARTNER TO LEAD CAPITAL DEVELOPMENT
2024-09-18,MSFT,0.149681,0.624058,Neutral,Macquarie Group mulls $2.3b stake sale in UK’s Wavenet: Bloomberg
2024-09-19,MSFT,0.139139,0.640196,Neutral,NATO unveils $2.2 billion theater upgrade plan: what’s in store for AMC and Cinemark?
2024-09-19,MSFT,-0.117479,0.635873,Neutral,"The Federal Reserve's interest rate cut cycle has started! The trend of the market shifting from large caps to small caps is becoming more and more apparent, and small cap stocks are gaining momentum."
2024-09-20,MSFT,0.225699,0.620769,Somewhat-Bullish,Why Constellation Energy and Vistra shares are building on massive gains
2024-09-21,MSFT,0.32973,0.648026,Somewhat-Bullish,Is the iShares Russell 1000 Growth ETF a Millionaire Maker?
2024-09-23,MSFT,-0.318383,0.945571,Somewhat-Bearish,This Microsoft Analyst Is No Longer Bullish; Here Are Top 5 Downgrades For Monday
2024-09-23,MSFT,0.304571,0.635399,Somewhat-Bullish,Capturing the in vogue ‘mega-forces’ in a one-stop ETF shop
2024-09-23,MSFT,0.12819,0.6257,Neutral,Should Motley Fool 100 Index ETF (TMFC) Be on Your Investing Radar?
2024-09-24,MSFT,0.248652,0.612714,Somewhat-Bullish,What does AI-driven stock selection mean for passive investors?
2024-09-25,MSFT,0.290244,0.635358,Somewhat-Bullish,"AI Model Is Better at Pricing Currencies Than Humans, ING Says"
2024-09-26,MSFT,0.28661,0.690993,Somewhat-Bullish,"InterDigital, IBD Stock Of The Day, Flirts With Buy Point After Analyst Day"
2024-09-26,MSFT,0.120958,0.643855,Neutral,"Zacks Investment Ideas feature highlights: Constellation Energy, Cameco and Vistra"
2024-09-26,MSFT,0.123314,0.628483,Neutral,Utilities ETFs: Plugged in for 2024
2024-09-27,MSFT,0.326695,0.727773,Somewhat-Bullish,AI Mania in Fine Fettle: ETFs to Invest
2024-09-27,MSFT,0.122443,0.609769,Neutral,The Compound and Friends: Tom Lee Strikes Back
2024-09-27,MSFT,0.331371,0.572391,Somewhat-Bullish,Hedge Funds Load Up on Tech Stocks Ahead of Rate Cuts
2024-09-28,MSFT,0.303992,0.825852,Somewhat-Bullish,3 of Joel Greenblatt’s Top 5 Stocks Are S&P 500 ETFs. These Are the 2 Stocks That Aren’t
2024-09-30,MSFT,0.302533,0.645747,Somewhat-Bullish,Wall Street Bets on $8.5 Billion Fashion Deal’s Fate in Trial
2024-10-01,MSFT,-0.22504,0.692543,Somewhat-Bearish,13 Charts on Q3′s Roller-Coaster Rally for Stocks and Bonds
2024-10-16,MSFT,0.048078,0.54893,Neutral,Intel Vs. Micron Technology: Which Chipmaker Holds The Edge?
2024-10-17,MSFT,0.05379,0.632744,Neutral,"iShares Top 20 U.S. Stocks ETF ETF Price, Holdings, & News (NYSEARCA:TOPT) $TOPT"
2024-10-17,MSFT,0.608421,0.635463,Bullish,Invest in the A.I. Ecosystem with AGIX
2024-10-18,MSFT,0.14114,0.639052,Neutral,State Street Corp's Strategic Acquisition of John Wiley & Sons Inc Shares
2024-10-18,MSFT,0.225799,0.729717,Somewhat-Bullish,Which AI Stocks Are Leading the Market to New Highs?
2024-10-18,MSFT,0.443299,0.830273,Bullish,"Why this money manager sees FirstService, Novo Nordisk and Microsoft as good long-term holdings"
2024-10-19,MSFT,0.307478,0.643193,Somewhat-Bullish,Broadcom Inc. (AVGO) Reports 47% Revenue Growth Driven by AI Demand; Mizuho Raises Price Target to $220 Amid Promising Collaboration with OpenAI
2024-10-20,MSFT,0.256908,0.64806,Somewhat-Bullish,Should you buy Nvidia stock now? It may be a once-in-a-generation opportunity
2024-10-20,MSFT,-0.315718,0.629532,Somewhat-Bearish,"XMAG ETF Analysis: Dividends, Returns NASDAQ:XMAG"
2024-10-20,MSFT,-0.123299,0.710503,Neutral,XMAG Stock Fund Price and Chart — NASDAQ:XMAG
2024-10-21,MSFT,0.130061,0.71287,Neutral,IBM releases new AI models for businesses as genAI competition heats up
2024-10-22,MSFT,-0.12942,0.599866,Neutral,"OpenAI launched a new browser to challenge Google's market position, causing Alphabet's stock price to fall."
2024-10-22,MSFT,0.342595,0.603883,Somewhat-Bullish,AIVC Stock Fund Price and Chart — AMEX:AIVC
2024-10-22,MSFT,0.33755,0.627768,Somewhat-Bullish,BlackRock broadens active ETF shelf with AI and tech funds
2024-10-23,MSFT,0.177793,0.573283,Somewhat-Bullish,"Confluent, Inc. (CFLT) Stock Price Quote Today & Current Price Chart"
2024-10-24,MSFT,0.320683,0.60843,Somewhat-Bullish,UAE investors snap up AI stocks after price drop
2024-10-24,MSFT,0.146966,0.610319,Neutral,Ingram Micro IPO: Major tech product distributor debuts on NYSE today after pricing its stock within target range
2024-10-25,MSFT,0.143567,0.61606,Neutral,Palantir Technologies Inc. (PLTR) and L3Harris Forge Strategic Partnership to Boost AI-Driven Defense Capabilities for Enhanced National Security
2024-10-25,MSFT,0.440604,0.56386,Bullish,Nuclear Energy ETF Continues Scorching Hot Run
2024-10-25,MSFT,-0.132397,0.607599,Neutral,Is Deckers Stock a Buy After Its Beat-And-Raise Quarter?
2024-10-26,MSFT,0.312489,0.743775,Somewhat-Bullish,Nvidia overtakes Apple as world's most valuable company
2024-10-28,MSFT,0.343301,0.741568,Somewhat-Bullish,"AI investment heat remains strong, with major asset management giants rushing to seize opportunities through etf deployment."
2024-10-28,MSFT,0.269282,0.612442,Somewhat-Bullish,Asset managers roll out new ETFs to tap in to AI buzz
2024-10-28,MSFT,0.233301,0.574001,Somewhat-Bullish,NextEra’s Diverse Business Is Set to Win As Energy Demand Rises
2024-10-28,MSFT,0.319474,0.610206,Somewhat-Bullish,How Nvidia Overtook Apple as World's Most Valuable Company
2024-10-29,MSFT,0.104375,0.628776,Neutral,Semiconductor Giant AMD’s Stock Tumble Post Earnings Release
2024-10-29,MSFT,0.141978,0.615954,Neutral,Alphabet reports excellent results for Q3 2024 📈
2024-10-29,MSFT,0.113572,0.626804,Neutral,Seagate: 4 Reasons to Buy-the-Dip on the Sell-the-News Reaction
2024-10-30,MSFT,0.321384,0.615397,Somewhat-Bullish,Fidelity MSCI Information Technology Index ETF Holdings
2024-10-30,MSFT,0.323169,0.617174,Somewhat-Bullish,Worried About an AI Bubble? Look to Surging International Stocks
2024-10-30,MSFT,0.302904,0.736875,Somewhat-Bullish,Vanguard Information Technology ETF: 3 Reasons Why Investors Need to Own VGT Right Now
2024-10-31,MSFT,0.329176,0.711579,Somewhat-Bullish,iShares Core S&P Total U.S. Stock Market ETF Holdings
2024-10-31,MSFT,0.312288,0.704691,Somewhat-Bullish,Dimensional US High Profitability ETF Holdings
2024-11-15,MSFT,0.306073,0.636107,Somewhat-Bullish,Palantir Stock Rises as It Shifts Listing To Nasdaq
2024-11-16,MSFT,0.348903,0.616575,Somewhat-Bullish,"Exchange Traded Concepts Trust - Range Nuclear Renaissance Index ETF (NUKZ) News, Articles, Events & Latest Updates"
2024-11-17,MSFT,-0.109849,0.630858,Neutral,UBS: Raymond James Financial (RJF) Is A Bottom-Ranked Quant Stock
2024-11-18,MSFT,-0.219714,0.640676,Somewhat-Bearish,FBY: One Of My Favorite Santa's Income Plays
2024-11-18,MSFT,0.382905,0.707604,Bullish,5 Stocks to Buy While They’re Still Cheap After Earnings
2024-11-18,MSFT,0.105693,0.647525,Neutral,Jim Cramer on Atlassian Corporation (TEAM)’s High Price-To-Earnings Ratio: ‘It’s Giving Me Vertigo’
2024-11-19,MSFT,0.38341,0.640729,Bullish,Kurv Investment Management Completes Reorganization of Yield Premium Suite to Proprietary Trust
2024-11-19,MSFT,0.00205,0.639327,Neutral,"Brown Advisory Flexible Equity ETF ETF Price, Holdings, & News (NASDAQ:BAFE)"
2024-11-19,MSFT,0.203194,0.576833,Somewhat-Bullish,Wearable Devices Ltd. Unveils Mudra Band and Mudra Link: Revolutionary Neural Wristband Technology for Gesture Control
2024-11-19,MSFT,-0.115762,0.631925,Neutral,SpotlightAI’s Rise: A Turning Point for Safe Pro Group or a Bubble Waiting to Burst?
2024-11-19,MSFT,0.130798,0.601455,Neutral,Applied Digital has emerged as a company to watch as Nvidia discloses stake in the company
2024-11-19,MSFT,0.481427,0.675594,Bullish,The Smartest Megacap Growth ETF to Buy With $500 Right Now
2024-11-19,MSFT,0.341998,0.841221,Somewhat-Bullish,Fidelity High Dividend ETF Holdings
2024-11-19,MSFT,0.299558,0.892746,Somewhat-Bullish,"For Utilities Stocks, Wait and Watch When It Comes to Nuclear Plant Deals"
2024-11-20,MSFT,0.32607,0.622134,Somewhat-Bullish,VOOG vs. SCHG: Which Is the Better Growth Stock ETF?
2024-11-20,MSFT,0.123677,0.836269,Neutral,Global X NASDAQ 100 Covered Call ETF Holdings
2024-11-21,MSFT,0.105225,0.768683,Neutral,America eats the world
2024-11-22,MSFT,0.123312,0.625916,Neutral,WestBridge Capital Offloads 2% Stake In Freshworks
2024-11-22,MSFT,0.248124,0.712118,Somewhat-Bullish,The 2025 Investment Outlook for Financial Advisors
2024-11-23,MSFT,0.319341,0.623248,Somewhat-Bullish,Here's How Much You Would Need to Invest in This Unstoppable Vanguard ETF Today to Grow Your Portfolio to $1 Million or More by Retirement
2024-11-23,MSFT,0.114145,0.625458,Neutral,Wells Fargo Sticks to Their Buy Rating for CoreWeave (CRWV)
2024-11-24,MSFT,0.432801,1.0,Bullish,"Microsoft Corporation (MSFT)-Backed AI Startup d-Matrix Ships First AI Chip, Aiming to Revolutionize User Interactions"
2024-11-25,MSFT,0.646883,1.0,Bullish,"TD Cowen Maintains Microsoft(MSFT.US) With Buy Rating, Maintains Target Price $475"
2024-11-26,MSFT,0.140202,0.632656,Neutral,"Best Buy broadly misses earnings estimates as consumers pull back on appliances, electronics"
2024-11-26,MSFT,0.326265,0.612568,Somewhat-Bullish,The S&P 500 is expected to return 10% in 2025
2024-11-27,MSFT,0.34583,0.649326,Somewhat-Bullish,Legacy landowner in West Texas surges on AI boom
2024-11-27,MSFT,0.274819,0.62207,Somewhat-Bullish,How this 19th-century land owner stocks grew nearly 200% in 2024 on AI boom
2024-11-27,MSFT,0.137672,0.741181,Neutral,The S&P 500 (SPY) Is Ready for a Sell-Off
2024-11-27,MSFT,0.113725,0.641165,Neutral,Forbes Global CEO conference 2024: Key insights and highlights
2024-11-27,MSFT,0.298896,0.597024,Somewhat-Bullish,3 Electricity Grid Plays for Your Portfolio
2024-11-27,MSFT,0.423936,0.996512,Bullish,Microsoft Corporation (MSFT): Partners with Coles Group for 5-Year Cloud and AI Deal to Enhance IT Infrastructure
2024-11-28,MSFT,0.311619,0.63058,Somewhat-Bullish,Nasdaq 100 Analysis: Can the Bullish Momentum Continue?
2024-11-29,MSFT,-0.310389,0.616243,Somewhat-Bearish,IGV: Software Is Expensive
2024-11-30,MSFT,-0.305213,0.74428,Somewhat-Bearish,‘Small caps are going to become more in favor in 2025': VettaFi’s research head doubles down on winning group
2024-12-23,MSFT,0.140056,0.742051,Neutral,Apple approaches $4 trillion valuation as investors bet on AI momentum
2024-12-24,MSFT,0.248042,0.61552,Somewhat-Bullish,"Hyperscale Data, Inc. (GPUS) Secures $25M for AI – Centric Data Center Expansion"
2024-12-24,MSFT,0.212523,0.642071,Somewhat-Bullish,A Look Back at Automation Software Stocks’ Q3 Earnings: UiPath (NYSE:PATH) Vs The Rest Of The Pack
2024-12-26,MSFT,-0.312918,1.0,Somewhat-Bearish,Microsoft Corp (MSFT) DCF Valuation: Is The Stock Undervalued?
2024-12-27,MSFT,0.13026,0.603384,Neutral,Bitwise proposes ETF for companies holding over 1000 Bitcoin
2024-12-28,MSFT,0.312725,0.6289,Somewhat-Bullish,Gaxos.ai Inc. (GXAI) Launches Meshy 4 Update to Revolutionize 3D Modeling Workflows for Game Developers
2024-12-29,MSFT,0.309552,0.604343,Somewhat-Bullish,"Jim Cramer on Apple Inc. (AAPL): ‘It Was The Dumb Money That Was Getting Out, Because Warren Buffett Or One Of His Assistants Made Us Nervous’"
2024-12-30,MSFT,0.449983,0.725374,Bullish,10 Best Performing Dividend ETFs In 2024
2024-12-30,MSFT,0.123286,0.877275,Neutral,Growth ETFs Shaken Up as Tech Takes on Value Blush
2024-12-30,MSFT,0.104633,0.647728,Neutral,Bitwise CEO Predicts Major Bitcoin Adoption by 2025
2024-12-31,MSFT,-0.202051,1.0,Somewhat-Bearish,Microsoft tells shareholders to reject call to invest corporate cash in Bitcoin
2024-12-31,MSFT,0.315989,0.603342,Somewhat-Bullish,The 10 Biggest Nvidia News Stories Of 2024 (So Far)
2024-12-31,MSFT,0.134369,1.0,Neutral,Microsoft on the Edge: Bounce Back or Breakdown? Gear Up for Earnings Showdown
2024-12-31,MSFT,0.214209,0.602972,Somewhat-Bullish,IBM eyes first record since 2013 as AI optimism fuels 19 percent rally
2024-12-31,MSFT,-0.606893,1.0,Bearish,"|The usa ""antitrust queen"" is tightening her grip in the final moments of her term, investigating microsoft's cloud computing business."
2024-12-31,MSFT,-0.219027,0.629626,Somewhat-Bearish,Goldman Sachs top strategist: We’re on the precipice of a summer correction
2024-12-31,MSFT,-0.233613,0.731318,Somewhat-Bearish,Perion Network Announces Preliminary Q1 2024 Financial Results
2024-12-31,MSFT,0.308997,0.603371,Somewhat-Bullish,The Growth of Tech and 25 Years of Nasdaq Futures
2024-12-31,MSFT,-0.123794,0.711892,Neutral,Nvidia dethroned as world's most valuable company after just a few days on top
2024-12-31,MSFT,0.309726,0.710784,Somewhat-Bullish,Goldman Sachs says to buy the dip in AI
2024-12-31,MSFT,0.320454,0.634464,Somewhat-Bullish,Nvidia’s Ascent to Most Valued Company Has Echoes of Dot-Com Boom - WSJ
2024-12-31,MSFT,0.143318,0.632883,Neutral,Amazon’s AI spending plans keep stock from joining tech rebound
2024-12-31,MSFT,0.332186,0.738425,Somewhat-Bullish,Assessing Five9 Stock's 2025 Comeback Potential After 48.3% Drop in 2024
2024-12-31,MSFT,0.306827,0.64085,Somewhat-Bullish,UiPath Stock is Consolidating: Is This the Right Time to Enter?
2024-01-25,NEE,0.632338,1.0,Bullish,NextEra Energy Stock: A Promising Opportunity for Investors
2024-01-26,NEE,0.270412,0.60495,Somewhat-Bullish,Three reasons clean energy stocks could come back in 2024
2024-02-13,NEE,0.279896,0.643463,Somewhat-Bullish,"Slumping Utilities Stocks, ETFs Have Rebound Potential"
2024-02-21,NEE,0.131815,0.639729,Neutral,7 Rock-Solid Utility Stocks to Power Your Portfolio for the Long Haul
2024-02-21,NEE,0.744721,0.883163,Bullish,"Forget Plug Power, These Unstoppable Stocks Are Better Buys"
2024-02-27,NEE,0.302976,1.0,Somewhat-Bullish,NextEra Energy Capital Holdings announces pricing of $900 million in aggregate principal amount of 3.00% exchangeable senior notes due 2027
2024-02-29,NEE,-0.21143,0.73914,Somewhat-Bearish,"El Merval perdió 19,5 % pero hubo una excepción: cuál fue la única acción que ganó en febrero"
2024-05-13,NEE,0.20529,0.59022,Somewhat-Bullish,WisdomTree adds nuclear to multi-megatrend thematic ETF
2024-05-17,NEE,0.21491,0.339897,Somewhat-Bullish,Why Volatility Means Opportunity in Carbon Markets
2024-06-04,NEE,0.341023,0.817754,Somewhat-Bullish,3 Sleeper Solar Stocks That You Will Wish You Bought Sooner
2024-06-06,NEE,0.343541,0.632234,Somewhat-Bullish,Should You Invest in the Utilities Select Sector SPDR ETF (XLU)?
2024-06-12,NEE,0.343133,0.615044,Somewhat-Bullish,Ishares Copper and Metals Mining ETF (ICOP-Q) Dividends
2024-06-13,NEE,0.421149,1.0,Bullish,NextEra Energy: Powering Up For The Next Decade Of Growth (NYSE:NEE)
2024-06-18,NEE,-0.331645,1.0,Somewhat-Bearish,NextEra Energy Stock Drops After Announcing Plans To Sell $2B of Equity Units
2024-06-18,NEE,0.01249,1.0,Neutral,NEE Stock: The $2 Billion Reason NextEra Energy Is Stumbling Today
2024-06-18,NEE,-0.212152,1.0,Somewhat-Bearish,Hot utility stock NextEra falls more than 2% after announcing plan to sell $2 billion in equity units
2024-06-18,NEE,0.278087,0.953452,Somewhat-Bullish,NextEra Energy announces sale of equity units
2024-06-20,NEE,0.492749,1.0,Bullish,"Hunton Andrews Kurth Represents NewLake Capital Partners, Inc. in At-The-Market Public Offering"
2024-07-15,NEE,0.439774,1.0,Bullish,NextEra Energy Stock: The Sustainable Powerhouse Fuelling The Future Of AI (NYSE:NEE)
2024-07-24,NEE,-0.276265,1.0,Somewhat-Bearish,Utility NextEra reports Q2 profit miss as segment sales slide
2024-07-25,NEE,0.291833,0.578867,Somewhat-Bullish,Nuclear Power’s Renaissance
2024-08-12,NEE,0.709431,0.979838,Bullish,3 Renewable Energy Stocks Positioned for Possible Sector Growth
2024-08-13,NEE,0.408108,0.904102,Bullish,US utilities poised to ride data center demand wave in second half
2024-08-19,NEE,0.32579,0.734531,Somewhat-Bullish,Is Now a Good Time to Invest in Hydrogen?
2024-08-30,NEE,0.543762,0.618084,Bullish,ERH: Utilities And High-Yield At A Discount (NYSE:ERH)
2024-08-31,NEE,0.115153,0.577304,Neutral,Jim Cramer’s Take on Evergy Inc. (EVRG): ‘Top Utility Stock To Consider’
2024-09-13,NEE,0.421915,0.936558,Bullish,Powering Your Portfolio: The Utility Sector's Electrifying Surge
2024-09-16,NEE,0.304038,1.0,Somewhat-Bullish,Then and Now – NextEra Energy
2024-09-23,NEE,0.20245,0.620111,Somewhat-Bullish,10 Best Infrastructure Stocks To Buy Now
2024-09-26,NEE,0.253908,0.771319,Somewhat-Bullish,Utilities ETFs: Plugged in for 2024
2024-10-16,NEE,0.087529,0.859556,Neutral,Greg Landsman trades in Diamondback Energy and NextEra Energy stocks By Investing.com
2024-10-17,NEE,0.620022,1.0,Bullish,NextEra Energy and the AI Energy Boom
2024-10-19,NEE,0.333709,0.81198,Somewhat-Bullish,Love the utilities XLU ETF? Boost it with some UTG
2024-10-24,NEE,0.004654,0.315088,Neutral,NextEra Energy's Strong Quarter Catches Wall Street's Eye
2024-10-28,NEE,0.329022,1.0,Somewhat-Bullish,NextEra plans to raise $1.5 billion to fund energy projects
2024-10-28,NEE,0.105455,1.0,Neutral,NextEra Energy to sell equity units
2024-10-28,NEE,0.511384,1.0,Bullish,NextEra’s Diverse Business Is Set to Win As Energy Demand Rises
2024-10-29,NEE,0.318006,0.579173,Somewhat-Bullish,PennyMac Mortgage Investment Trust: Series C Preferred Shares Offer 8.2% Dividend Yield
2024-10-31,NEE,0.380901,1.0,Bullish,"Hunton Andrews Kurth Advises on NextEra Energy, Inc.’s $1.5 Billion Equity Units Offering"
2024-12-01,NEE,0.304419,0.589956,Somewhat-Bullish,Private Infrastructure: An Asset Class for All Economic Conditions
2024-12-31,NEE,0.349272,1.0,Somewhat-Bullish,NextEra Energy Secures $1.5 Billion For AI-Driven Projects
2024-01-09,NVDA,0.345788,0.862314,Somewhat-Bullish,Naysayers Were Wrong About the 60/40 Portfolio. Here’s Why.
2024-01-10,NVDA,-0.324161,0.642497,Somewhat-Bearish,"Fundsmith Underperforms, Smith Takes Aim at AI Hype"
2024-01-11,NVDA,0.305166,0.608608,Somewhat-Bullish,Upcoming Events
2024-01-11,NVDA,0.346814,0.619493,Somewhat-Bullish,SHOC Stock Fund Price and Chart — NYSE:SHOC
2024-01-12,NVDA,0.147812,0.620847,Neutral,"Taiwan's strength in semiconductors could be its 'Achilles heel,' economist says"
2024-01-17,NVDA,0.293745,0.636324,Somewhat-Bullish,3 Themes for 2024 and Beyond
2024-01-17,NVDA,0.402325,0.835331,Bullish,What Does 2024 Hold for the Magnificent Seven?
2024-01-18,NVDA,0.426375,1.0,Bullish,Mark Zuckerberg indicates Meta is spending billions of dollars on Nvidia AI chips
2024-01-18,NVDA,0.402419,1.0,Bullish,Nvidia and AMD shares hit record highs on AI chip surge
2024-01-22,NVDA,0.48057,1.0,Bullish,NVIDIA Corporation (NVDA) Stock Rocketed Over 200% in 2023
2024-01-25,NVDA,0.302775,0.617971,Somewhat-Bullish,Intel stock sinks more than 10% as early 2024 outlook comes up short
2024-01-25,NVDA,0.444802,1.0,Bullish,Nvidia billionaire Jensen Huang dines with TSMC execs in Taiwan to discuss the great AI chip shortage
2024-01-26,NVDA,0.340738,0.602122,Somewhat-Bullish,AI & The Dragon: What Trends Will Dominate 2024?
2024-01-29,NVDA,0.343417,0.746163,Somewhat-Bullish,XLK ETF: A Better Way To Invest In Microsoft But Volatility Comes First (NYSEARCA:XLK)
2024-01-29,NVDA,0.423153,0.83657,Bullish,Rebellions Inc. Raises $124M in Series B Funding to Accelerate AI Chip Development
2024-01-29,NVDA,0.114992,0.848007,Neutral,AMD earnings are around the corner: This number could be the ‘swing factor’
2024-01-31,NVDA,0.472571,0.883197,Bullish,15 semiconductor companies that have followed Nvidia's lead in two key areas
2024-01-31,NVDA,0.419315,0.87731,Bullish,"2 Unstoppable Technology ETFs That Could Turn $100,000 Into $1 Million Over the Next 30 Years"
2024-01-31,NVDA,0.332373,0.758805,Somewhat-Bullish,Top metaverse investors and how to start investing
2024-02-01,NVDA,0.3022,0.604772,Somewhat-Bullish,Fund selectors flock to AI and semiconductor ETFs in January
2024-02-12,NVDA,0.48084,1.0,Bullish,AI frenzy puts Nvidia briefly ahead of Amazon in market value
2024-02-12,NVDA,0.748361,0.828982,Bullish,Beamr’s collaboration with Nvidia helps fuel stock’s massive rally
2024-02-12,NVDA,0.601775,0.804135,Bullish,5 Investors Betting Big on Beamr Imaging (BMR) Stock
2024-02-12,NVDA,0.104415,0.829198,Neutral,GraniteShares 2x Long NVDA Daily ETF (NVDL) Short Interest & Short Float | Updated Mar 2026
2024-02-12,NVDA,0.446125,1.0,Bullish,Nvidia Overtakes Amazon in Market Value
