date,ticker,sentiment,relevance,label,headline
2024-06-11,BLK,0.308971,0.600156,Somewhat-Bullish,TDAM hopes to quintuple its ETF assets by 2029
2024-06-11,BLK,0.317675,0.747202,Somewhat-Bullish,Thailand approves first spot BTC ETF
2024-06-11,BLK,0.140309,0.623592,Neutral,Bitcoin ETFs Pause 19-day Inflow Streak as BTC Price Plunges
2024-06-11,BLK,0.225734,0.707178,Somewhat-Bullish,The value of securities lending in three charts
2024-06-12,BLK,0.244025,0.908437,Somewhat-Bullish,"BlackRock to liquidate 9 ETFs, including a $401 million iShares ETF"
2024-06-12,BLK,0.287876,0.619054,Somewhat-Bullish,A Strong Dollar Lifts Currency-Hedged Funds. There’s a Better Reason to Own Them.
2024-06-13,BLK,0.404722,0.88897,Bullish,"ISS Rejects ALL Proposals to Terminate BlackRock as Investment Adviser and Recommends Shareholders Support ALL BlackRock Board Nominees at BCAT, BMEZ, BNY, MPA on WHITE Proxy Card at Upcoming CEF Annu"
2024-06-13,BLK,0.330451,0.705722,Somewhat-Bullish,Active ETFs take centre stage
2024-06-13,BLK,0.111993,0.61535,Neutral,"With 84% ownership of the shares, Cadence Bank (NYSE:CADE) is heavily dominated by institutional owners"
2024-06-13,BLK,0.430478,1.0,Bullish,BlackRock launches climate transition ETF range
2024-06-14,BLK,0.687943,0.722308,Bullish,The Assets of the Global ETF Industry Reached 12.89 Trillion Dollars in May
2024-06-17,BLK,0.132869,0.626115,Neutral,Naver-Backed Webtoon Seeks as Much as $315 Million in IPO
2024-06-17,BLK,0.233523,0.710486,Somewhat-Bullish,Naver's Webtoon Entertainment aims up to $2.67 bln valuation in US IPO
2024-06-17,BLK,0.273247,0.729791,Somewhat-Bullish,3 Great Funds for the Class of 2024
2024-06-18,BLK,0.129761,1.0,Neutral,"Interest rates will remain higher for longer, say BlackRock analysts"
2024-06-18,BLK,0.341506,0.931107,Somewhat-Bullish,BlackRock Strengthens Active ETF Platform with Two ETFs
2024-06-18,BLK,0.425053,0.910235,Bullish,"BlackRock launches more active ETFs, ramps up lineup amid ‘tremendous’ demand"
2024-06-18,BLK,0.401763,1.0,Bullish,"BlackRock launches more active ETFs, ramps up lineup amid ‘tremendous’ demand"
2024-06-18,BLK,0.40884,1.0,Bullish,"BlackRock launches more active ETFs, ramps up lineup amid ‘tremendous’ demand"
2024-06-18,BLK,0.405917,1.0,Bullish,"BlackRock launches more active ETFs, ramps up lineup amid ‘tremendous’ demand"
2024-06-18,BLK,0.416583,1.0,Bullish,"BlackRock launches more active ETFs, ramps up lineup amid ‘tremendous’ demand"
2024-06-18,BLK,0.116516,0.648784,Neutral,Is iShares International Equity Factor ETF (INTF) a Strong ETF Right Now?
2024-06-20,BLK,0.423108,0.724333,Bullish,It’s now possible to invest in bitcoin on Australia’s largest stock exchange. Is the currency going mainstream?
2024-06-20,BLK,0.347069,0.63727,Somewhat-Bullish,ACTIVE ETFs AND SMAs THRIVE AS MUTUAL FUNDS LOSE MORE GROUND
2024-06-21,BLK,0.348732,1.0,Somewhat-Bullish,US spot Bitcoin ETF records $140 million in daily net outflows
2024-06-21,BLK,0.223946,0.676975,Somewhat-Bullish,"With 59% institutional ownership, Midland States Bancorp, Inc. (NASDAQ:MSBI) is a favorite amongst the big guns"
2024-06-21,BLK,0.340436,0.745215,Somewhat-Bullish,VanEck sets 0.20% fee for proposed spot ethereum ETF
2024-06-24,BLK,0.142195,0.61453,Neutral,Sustainable ETFs: A Polarized Global Market with Europe as the Leading Region
2024-06-25,BLK,-0.329386,0.981662,Somewhat-Bearish,Boaz Weinstein Doesn’t Care About Being ‘Besties’ with BlackRock’s Larry Fink
2024-06-25,BLK,0.118668,0.747404,Neutral,VanEck to Waive Fee Initially on Spot Ethereum ETF
2024-06-26,BLK,0.250951,0.554976,Somewhat-Bullish,"With 79% institutional ownership, The Sherwin-Williams Company (NYSE:SHW) is a favorite amongst the big guns"
2024-06-27,BLK,0.202098,0.628492,Somewhat-Bullish,Newly-proposed stacked ETF wants to give investors leveraged exposure to bitcoin and gold
2024-06-27,BLK,0.131168,0.561124,Neutral,Bond market: Why foreign funds are flocking to India despite entry barriers
2024-06-27,BLK,0.148536,0.636803,Neutral,ETFs in Africa: A Complete Investing Guide
2024-06-27,BLK,0.184071,0.74013,Somewhat-Bullish,South Korea-Owned Webtoon Launches Its Nasdaq IPO
2024-06-28,BLK,0.310901,1.0,Somewhat-Bullish,"BlackRock Wants to Be the Biggest in Active ETFs, Too"
2024-06-28,BLK,0.323632,0.638265,Somewhat-Bullish,"Webtoon Entertainment soars on Nasdaq debut, eyes global franchise success"
2024-06-28,BLK,0.133626,0.616943,Neutral,Fidelity’s Preferred Stock ETF FPFD Crosses 3 Years
2024-07-01,BLK,0.328579,0.938018,Somewhat-Bullish,BlackRock Adds Max Buffer ETF to Active ETF Platform
2024-07-01,BLK,0.415639,0.944437,Bullish,BlackRock launches global real estate ESG ETF
2024-07-10,BLK,0.349716,0.83535,Somewhat-Bullish,ESG advocate BlackRock doubles stake in offshore vessel giant Tidewater to $600m
2024-07-10,BLK,0.109866,0.640023,Neutral,Harbor Capital Advisors Expands Growing ETF Lineup with the Harbor AlphaEdge Small Cap Earners ETF
2024-07-12,BLK,0.348147,0.606403,Somewhat-Bullish,Active Bond ETFs Continue to See Record Inflows This Year
2024-07-12,BLK,0.132154,0.6138,Neutral,Ares Commercial Real Estate Corporation (NYSE:ACRE) is definitely on the radar of institutional investors who own 48% of the company
2024-07-15,BLK,0.126276,0.617397,Neutral,Archer-Daniels-Midland Company (NYSE:ADM) is largely controlled by institutional shareholders who own 81% of the company
2024-07-15,BLK,0.137628,0.731477,Neutral,IBIT vs. GBTC: Which Bitcoin ETF Should You Buy?
2024-07-15,BLK,0.307947,0.933327,Somewhat-Bullish,BlackRock Assets Under Management Rise Through $10T
2024-07-15,BLK,0.305566,0.649582,Somewhat-Bullish,Five top European equity funds year-to-date
2024-07-16,BLK,0.427648,1.0,Bullish,Why BlackRock's Larry Fink Believes 'Everyone' Should Take Another Look At Bitcoin
2024-07-16,BLK,0.032543,0.333962,Neutral,"'Bitcoin Is A Legitimate Financial Instrument,' Says BlackRock CEO Larry Fink"
2024-07-16,BLK,0.211609,0.630832,Somewhat-Bullish,8 of the Best International Fund Managers
2024-07-18,BLK,0.343902,0.722362,Somewhat-Bullish,New BlackRock ETFs Include U.S. Manufacturing Fund
2024-07-18,BLK,0.219499,0.746332,Somewhat-Bullish,Product & Service Launches – 7/18/24
2024-07-18,BLK,0.14,0.646995,Neutral,CLO ETF managers search for foothold in European market
2024-07-18,BLK,0.262204,0.624665,Somewhat-Bullish,Lazard AM makes the case for emerging markets
2024-07-22,BLK,0.30225,0.942193,Somewhat-Bullish,BlackRock strengthens thematic offering with US manufacturing ETF
2024-07-22,BLK,0.295799,0.555992,Somewhat-Bullish,"Fidelity Investments® Launches Spot Ether Exchange-Traded Product, Fidelity® Ethereum Fund (FETH)"
2024-07-23,BLK,0.333969,0.844287,Somewhat-Bullish,9 new spot Ether ETFs are here. What to know about their fees and more
2024-07-23,BLK,0.711249,0.931501,Bullish,BlackRock’s IBIT Leads Spot Bitcoin ETF Inflows with $526.7M
2024-07-23,BLK,0.445692,0.929227,Bullish,Blackrock Makes the Case for Ethereum ahead of ETHA ETF launch
2024-07-24,BLK,0.438588,0.710642,Bullish,What Is An Ethereum ETF? The Best Spot ETH ETFs
2024-07-25,BLK,0.256932,0.719972,Somewhat-Bullish,Going Under the Hood of Buffer ETFs
2024-07-25,BLK,0.149545,0.644894,Neutral,Northern Trust shares its buying power approach to family offices
2024-07-26,BLK,0.341751,0.610486,Somewhat-Bullish,State of Michigan Retirement System owns nearly $6.6 million worth of ARKB spot bitcoin ETF
2024-07-26,BLK,0.334589,0.708983,Somewhat-Bullish,Bitwise Ethereum ETF Banner Hung on New York Stock Exchange
2024-07-26,BLK,0.203612,0.615514,Somewhat-Bullish,"Hashdex Files to Issue Joint Bitcoin, Ethereum ETF"
2024-07-29,BLK,0.139651,0.553972,Neutral,Grayscale Investments® Provides Update Regarding Upcoming Corporate Action for Grayscale Bitcoin Trust (Ticker: GBTC) Shareholders
2024-07-30,BLK,0.212851,0.527855,Somewhat-Bullish,"Know Your Fund Manager | Satish Ramanathan, CIO-Equity, JM Financial Asset Management"
2024-07-30,BLK,0.177912,0.715783,Somewhat-Bullish,"With 88% ownership of the shares, Cummins Inc. (NYSE:CMI) is heavily dominated by institutional owners"
2024-08-11,BLK,-0.132372,0.640297,Neutral,Why is NICE’s share price tumbling?
2024-08-12,BLK,0.30538,0.639555,Somewhat-Bullish,"With Muni Bonds, Active Management Holds Appeal"
2024-08-12,BLK,0.129779,0.713383,Neutral,Grayscale Ethereum Trust Records Zero Outflows for the First Time Post ETF Conversion
2024-08-12,BLK,0.14115,0.622852,Neutral,Opportunity Knocks for Emerging Markets ETFs
2024-08-12,BLK,0.100916,0.615272,Neutral,Downside protected ETF battle continues to heat up
2024-08-13,BLK,0.251144,0.622513,Somewhat-Bullish,Simplify Launches Bond ETF for Emerging Markets
2024-08-13,BLK,0.445778,0.756123,Bullish,"More ETFs Tracking Digital Assets, Crypto Indexes, Are Imminent"
2024-08-14,BLK,0.00568,0.318004,Neutral,"BlackRock, Vanguard big purchasers of Trump Media shares in Q2, filings show"
2024-08-14,BLK,0.216083,0.80936,Somewhat-Bullish,"Morgan Stanley reveals $187 million position in BlackRock's spot Bitcoin ETF, nearly sells out of GBTC in Q2"
2024-08-14,BLK,0.287926,0.696074,Somewhat-Bullish,"Goldman Sachs Held More Than $400M In Spot Bitcoin ETFs, Filing Shows"
2024-08-14,BLK,0.441151,0.943054,Bullish,BlackRock iShares Bitcoin Trust Breaks ETF Chart With $20 Billion Inflow
2024-08-14,BLK,0.317831,0.733475,Somewhat-Bullish,Goldman Sachs Holds The Most Bitcoin ETF Shares Among US Investment Banks
2024-08-14,BLK,0.294507,0.712808,Somewhat-Bullish,Goldman Sachs reports $418 million in spot bitcoin ETF holdings as of June 30
2024-08-14,BLK,0.242028,0.724316,Somewhat-Bullish,Looking to Address Climate Change With Your Investments? Try Green Bonds
2024-08-15,BLK,0.341017,0.749517,Somewhat-Bullish,"Capula, Schonfeld, Point72 among hedge funds riding bitcoin ETFs"
2024-08-15,BLK,0.13301,0.62247,Neutral,NYSE American LLC withdraws proposal to list and trade options on spot Bitcoin ETFs
2024-08-15,BLK,0.331496,0.860016,Somewhat-Bullish,What is BlackRock’s iShares Ethereum Trust ETF? (ETHA)
2024-08-16,BLK,0.11442,0.72271,Neutral,"Fidelity Eyes Stablecoins, Tokenised Treasuries in Crypto Push"
2024-08-19,BLK,0.348533,0.614926,Somewhat-Bullish,Bitwise To Buy ETC Group To Expand ETF Footprint
2024-08-20,BLK,0.148985,0.702216,Neutral,2024 PLANADVISER DCIO Survey
2024-08-21,BLK,0.158906,0.731778,Somewhat-Bullish,BOE Stock Fund Price and Chart — NYSE:BOE
2024-08-21,BLK,0.463727,1.0,Bullish,BlackRock’s ETHA Becomes First Ethereum ETF to Cross $1B in Net Inflows
2024-08-21,BLK,0.344044,0.916592,Somewhat-Bullish,BlackRock’s iShares Ethereum Trust Hits $1B in Net Inflows to Set New Benchmark
2024-08-21,BLK,0.147387,0.411176,Neutral,Western Asset's co-CIO Leech takes leave of absence amid SEC probe
2024-08-22,BLK,-0.641051,1.0,Bearish,"Indiana Secretary of State issues Cease and Desist against BlackRock, Inc. for alleged fraud against Hoosier investors"
2024-08-22,BLK,0.277408,0.713607,Somewhat-Bullish,Analyst Commentary Highlights Upgraded Price Target and Mergers Activity for AES Amid Shifting Sector Trends
2024-08-27,BLK,0.501965,1.0,Bullish,BlackRock Lists Ethereum ETF on Brazilian Stock Exchange
2024-08-27,BLK,0.11181,0.610285,Neutral,Emerging Markets vs. Developed Markets: Where Should You Invest?
2024-08-28,BLK,0.108984,0.636486,Neutral,KraneShares Launches AI-Powered China A-Share ETF (KCAI)
2024-08-28,BLK,0.116153,0.714431,Neutral,Active funds fell short of passive peers in latest research by Morningstar
2024-08-29,BLK,0.144139,0.337,Neutral,3 Key Considerations for Fixed Income in Months Ahead
2024-08-30,BLK,0.113267,0.740475,Neutral,Invesco Doubles Down on Tech Concentration With ‘Mega’ QQQ Fund
2024-08-30,BLK,-0.116922,0.805548,Neutral,BlackRock’s iShares Bitcoin Trust (IBIT) Suffers Outflows for the Second Time Since Launching: BTC ETF Flow Data
2024-08-30,BLK,0.135367,0.635997,Neutral,Bitwise: The path to Bitcoin ETF approval
2024-09-12,BLK,0.312352,0.609465,Somewhat-Bullish,BlackRock Innovation & Growth term trust sees $1.28m stock purchase by Saba Capital
2024-09-12,BLK,0.12046,0.720934,Neutral,"Crypto Bank Anchorage Digital, BitGo Take on Custody for ARK 21Shares Bitcoin ETF"
2024-09-12,BLK,0.274982,0.834271,Somewhat-Bullish,BlackRock Inc. Expands Stake in CTO Realty Growth Inc.
2024-09-12,BLK,0.086466,0.847916,Neutral,BlackRock Inc. Reduces Stake in Emergent BioSolutions Inc.
2024-09-12,BLK,0.10972,0.988016,Neutral,BlackRock Inc.'s Strategic Reduction in CarParts.com Inc. Holdings
2024-09-12,BLK,0.151921,0.924893,Somewhat-Bullish,BlackRock Inc. Bolsters Position in Iron Mountain Inc with Recent Share Acquisition
2024-09-12,BLK,0.42232,1.0,Bullish,BlackRock Inc. Expands Stake in Louisiana-Pacific Corp
2024-09-13,BLK,0.109236,0.648681,Neutral,"BlackRock Municipal Income Fund, Inc. (MUI) Announces Variable Rate Demand Preferred Shares Action"
2024-09-13,BLK,0.135573,0.730833,Neutral,"BlackRock Municipal Income Fund, Inc. (MUI) Announces Variable Rate Demand Preferred Shares Action"
2024-09-13,BLK,0.277713,0.737235,Somewhat-Bullish,ETH ETFs: The Ultimate Guide To Spot Ethereum ETFs
2024-09-13,BLK,0.30998,0.736869,Somewhat-Bullish,Lazard Asset Management launches listed private markets fund
2024-09-14,BLK,0.241685,0.637186,Somewhat-Bullish,Goldman Thinks Jones Lang LaSalle Incorporated (JLL) Is A Long-Term AI Stock Set To Rally Eventually
2024-09-16,BLK,0.200814,0.601309,Somewhat-Bullish,BNY aims to capitalize on growing demand for alternative investments
2024-09-16,BLK,0.03932,0.895211,Neutral,Why investors park billions in high-fee legacy ETFs
2024-09-16,BLK,0.237234,0.710367,Somewhat-Bullish,Who owns Live Nation and Ticketmaster?
2024-09-16,BLK,0.3082,0.714796,Somewhat-Bullish,"ETFGI reports the global ETFs industry had a record 1,192 new products launches in the first 8 months of the year"
2024-09-17,BLK,0.317448,0.600344,Somewhat-Bullish,Investors Bet on Emerging Market Bonds Amid Fed Rate Cut Expectations
2024-09-17,BLK,0.317935,0.625351,Somewhat-Bullish,"BNY Mellon to Roll Out Alts Bridge, Enhance Alternative Offerings"
2024-09-17,BLK,0.243845,0.630915,Somewhat-Bullish,"CLO ETFs in Focus: Virtus, Blondbloxx, Nuveen Plot Entrance"
2024-09-18,BLK,0.14517,0.747518,Neutral,Who Owns DraftKings?
2024-09-18,BLK,0.109137,0.551166,Neutral,MSTU - T-Rex 2X Long MSTR Daily Target ETF Stock Price and Quote
2024-09-19,BLK,0.427511,0.729028,Bullish,South Korean investors bet big on ETFs tracking Indian equities
2024-09-19,BLK,0.107748,0.732334,Neutral,"Saba Capital Management, L.P. Expands Stake in BlackRock Health Sciences Trust II"
2024-09-20,BLK,0.120463,0.630822,Neutral,SPY's Big Outflows Hamper State Street: Morningstar
2024-09-22,BLK,0.220645,0.647941,Somewhat-Bullish,"With 80% ownership, Leggett & Platt, Incorporated (NYSE:LEG) boasts of strong institutional backing"
2024-09-23,BLK,0.311615,0.730823,Somewhat-Bullish,Capturing the in vogue ‘mega-forces’ in a one-stop ETF shop
2024-09-24,BLK,0.302559,0.646609,Somewhat-Bullish,Apollo’s Atlas SP Launches $5B Credit Strategy With BNP Paribas
2024-09-25,BLK,0.306206,0.733292,Somewhat-Bullish,VanEck’s New Fixed Income ETF Focuses on CLOs
2024-09-25,BLK,0.348533,0.633756,Somewhat-Bullish,ETF 360: Winslow Takes an Active Growth Approach
2024-09-25,BLK,0.130394,0.608008,Neutral,"With Uncertainty Ahead, Intermediate Bonds Offer Opportunities"
2024-09-26,BLK,0.322188,0.70483,Somewhat-Bullish,Product roundup: Asset managers get active with fixed income
2024-09-26,BLK,0.236066,0.637386,Somewhat-Bullish,Inside Brookfield’s pitch for a $50B ‘Maple Fund’
2024-09-26,BLK,0.402911,0.967197,Bullish,RBC iShares Expands Access to BlackRock’s Award-Winning Investment Platform with Active ETFs
2024-09-27,BLK,0.412236,0.912693,Bullish,RBC iShares gives Canadian investors expanded access to active ETFs
2024-09-27,BLK,0.139917,0.710285,Neutral,The Compound and Friends: Tom Lee Strikes Back
2024-09-30,BLK,0.139532,0.73769,Neutral,"BlackRock Announces Results of Shareholder Vote at Special Meeting Relating to BlackRock Municipal Income Fund, Inc. (MUI) Conversion to Unlisted Closed-End Interval Fund Structure"
2024-09-30,BLK,0.043992,0.73802,Neutral,"BlackRock Announces Results of Shareholder Vote at Special Meeting Relating to BlackRock Municipal Income Fund, Inc. (MUI) Conversion to Unlisted Closed-End Interval Fund Structure"
2024-09-30,BLK,0.335716,0.722561,Somewhat-Bullish,LTCM vet Haghani enters the ETF fray
2024-09-30,BLK,0.292136,0.869471,Somewhat-Bullish,Does BlackRock Own More BTC than Binance?
2024-09-30,BLK,0.313834,0.600631,Somewhat-Bullish,"Citigroup, Apollo Enter Private Credit Pact"
2024-09-30,BLK,0.025004,0.611258,Neutral,Reservoir Media faces activist investor call for ‘strategic review to maximize shareholder value’
2024-10-01,BLK,0.133921,0.649345,Neutral,American Century marks European entry with double active ETF launch
2024-10-01,BLK,0.111987,0.713834,Neutral,Syntax reorganizes six ‘Stratified’ US equity ETFs
2024-10-18,BLK,0.239242,0.649809,Somewhat-Bullish,SEC gives NYSE and Cboe the go-ahead to list options trading for multiple spot bitcoin ETFs
2024-10-18,BLK,0.45181,0.838526,Bullish,BlackRock's ETF chief says 75% of its bitcoin buyers are crypto fans new to Wall Street
2024-10-19,BLK,0.208888,0.7206,Somewhat-Bullish,U.S. SEC gives green light for options listing for spot bitcoin ETFs to NYSE
2024-10-21,BLK,0.408883,0.91766,Bullish,World’s largest investment managers see assets hit $128 trillion in return to growth
2024-10-22,BLK,0.406391,1.0,Bullish,BlackRock Expands AI and Tech Investment Opportunities with New Active ETFs
2024-10-22,BLK,0.31509,0.603355,Somewhat-Bullish,TEK Stock Fund Price and Chart — AMEX:TEK
2024-10-22,BLK,0.413734,0.929807,Bullish,BlackRock Broadens Access to Global AI and Technology Growth Opportunities Through Two New Active ETFs
2024-10-22,BLK,0.319288,0.9296,Somewhat-Bullish,BlackRock taps into AI frenzy with two new ETFs
2024-10-22,BLK,0.328396,0.907259,Somewhat-Bullish,BlackRock broadens active ETF shelf with AI and tech funds
2024-10-23,BLK,0.404769,0.747598,Bullish,Asian equity funds overtake global markets
2024-10-23,BLK,0.412871,1.0,Bullish,BlackRock Launches ETFs Focused On A.I.
2024-10-23,BLK,0.202602,0.633661,Somewhat-Bullish,CLO ETFs: Resilient in the Face of Lower Rates?
2024-10-23,BLK,0.349651,0.60798,Somewhat-Bullish,New on Xetra: Active ETFs from Fidelity offer access to high-yield euro and US dollar corporate bonds with a rating below investment grade
2024-10-24,BLK,0.014731,0.739414,Neutral,Ways to target – or avoid — Big Tech and megacap stocks via ETFs amid AI frenzy
2024-10-24,BLK,0.119567,0.636365,Neutral,Ways to target – or avoid — Big Tech and megacap stocks via ETFs amid AI frenzy
2024-10-24,BLK,0.135409,0.647873,Neutral,"With 69% ownership of the shares, Bandwidth Inc. (NASDAQ:BAND) is heavily dominated by institutional owners"
2024-10-24,BLK,0.100201,0.644174,Neutral,TOPT Stock Fund Price and Chart — AMEX:TOPT
2024-10-24,BLK,0.124505,0.601975,Neutral,SEC Fines WisdomTree $4M for ETF Greenwashing
2024-10-24,BLK,0.42664,0.912799,Bullish,BlackRock’s Two Newest Active ETFs Target AI and Tech
2024-10-24,BLK,0.403625,1.0,Bullish,BlackRock unveils new funds focused on AI growth
2024-10-24,BLK,0.127847,0.634165,Neutral,Do Investors Need Corporate Bond Exposure?
2024-10-24,BLK,0.401525,0.91655,Bullish,New BlackRock ETFs Focus on Top-Performing Stocks
2024-10-25,BLK,0.221738,0.7273,Somewhat-Bullish,Palantir Technologies Inc. (PLTR) and L3Harris Forge Strategic Partnership to Boost AI-Driven Defense Capabilities for Enhanced National Security
2024-10-25,BLK,0.115092,0.59892,Neutral,"VettaFi Fixed Income Symposium Asks, Why Turn to Active ETFs?"
2024-10-25,BLK,0.022622,0.315455,Neutral,"MicroStrategy Pushes Higher As BlackRock Buys In, But Peter Schiff Sees A Crash Ahead"
2024-10-25,BLK,0.31685,0.621274,Somewhat-Bullish,MSCI hires ESG and climate business head
2024-10-27,BLK,0.143974,0.636487,Neutral,"With 80% ownership of the shares, Cannae Holdings, Inc. (NYSE:CNNE) is heavily dominated by institutional owners"
2024-10-28,BLK,0.226925,0.74504,Somewhat-Bullish,"AI investment heat remains strong, with major asset management giants rushing to seize opportunities through etf deployment."
2024-10-28,BLK,0.329328,0.715636,Somewhat-Bullish,Asset managers roll out new ETFs to tap in to AI buzz
2024-10-29,BLK,0.348645,0.979694,Somewhat-Bullish,"Jio Financial Services, BlackRock set up mutual fund joint ventures; stock rises 3%"
2024-10-29,BLK,0.241038,0.611501,Somewhat-Bullish,2070 TDFs Are Here for Youngest Workers
2024-10-29,BLK,0.119312,0.704948,Neutral,ETF-Test: iShares MSCI World Paris-Aligned Climate UCITS ETF
2024-10-30,BLK,0.132092,0.625363,Neutral,"MaxCyte, Inc. (LON:MXCT) is largely controlled by institutional shareholders who own 65% of the company"
2024-10-31,BLK,0.262212,0.83464,Somewhat-Bullish,BlackRock launches ETF that expands beyond the ‘Magnificent Seven'
2024-10-31,BLK,0.132014,1.0,Neutral,BlackRock launches ETF that expands beyond the 'Magnificent Seven'
2024-10-31,BLK,0.203364,0.703097,Somewhat-Bullish,Here’s how ETF investors can lock in higher yields as Treasury rates jumped in October
2024-10-31,BLK,0.100762,0.631371,Neutral,Here’s how ETF investors can lock in higher yields as Treasury rates jumped in October
2024-10-31,BLK,0.337558,0.700322,Somewhat-Bullish,Hong Kong crypto ETFs see tepid investor demand even as bitcoin prices surge
2024-10-31,BLK,0.204854,0.918924,Somewhat-Bullish,BlackRock launches ETF that expands beyond the ‘Magnificent Seven'
2024-10-31,BLK,0.146839,0.603012,Neutral,PAAA: PGIM's Answer To The AAA CLO Dilemma
2024-10-31,BLK,0.340824,0.624285,Somewhat-Bullish,"Canary Capital Files for Solana ETF, Following XRP and Litecoin Applications"
2024-10-31,BLK,0.143731,0.623051,Neutral,"Institutional investors in Alerus Financial Corporation (NASDAQ:ALRS) see US$64m decrease in market cap last week, although long-term gains have benefitted them."
2024-10-31,BLK,0.364392,0.717298,Bullish,A Look Back at Crypto ETFs
2024-11-15,BLK,0.04416,0.606069,Neutral,"EWS: This Singapore ETF Offers A Good Dividend Yield, But Caution Prevails (EWS)"
2024-11-18,BLK,0.309356,0.727129,Somewhat-Bullish,BlackRock Feeds Rising ETF Demand With First Mutual-Fund Flip
2024-11-18,BLK,0.316707,0.902749,Somewhat-Bullish,BlackRock just did its first mutual fund-to-ETF conversion. Here’s why.
2024-11-18,BLK,0.430722,1.0,Bullish,BlackRock just did its first mutual fund-to-ETF conversion. Here’s why.
2024-11-18,BLK,0.331041,0.900245,Somewhat-Bullish,BlackRock just did its first mutual fund-to-ETF conversion. Here’s why.
2024-11-18,BLK,0.324844,0.714363,Somewhat-Bullish,BlackRock just did its first mutual fund-to-ETF conversion. Here’s why.
2024-11-18,BLK,0.545315,1.0,Bullish,BlackRock just did its first mutual fund-to-ETF conversion. Here’s why.
2024-11-19,BLK,0.332726,0.706296,Somewhat-Bullish,Grayscale files updated prospectus for its Bitcoin Covered Call ETF
2024-11-19,BLK,0.408626,0.84182,Bullish,"Bitcoin ETF options begin trading, ushering in a new way for investors to hedge their bitcoin exposure"
2024-11-19,BLK,0.313748,0.608289,Somewhat-Bullish,MARA Stock News: Marathon Digital's Bold $850 Million Move Signals Major Growth Plans
2024-11-19,BLK,0.314406,0.630043,Somewhat-Bullish,Logitech International S.A. (VTX:LOGN) is largely controlled by institutional shareholders who own 67% of the company
2024-11-19,BLK,0.328325,0.707947,Somewhat-Bullish,"Biotech, Bitcoin, Gold ETFs Among 2025 Best Bets: iShares"
2024-11-20,BLK,0.316816,0.649921,Somewhat-Bullish,Análisis del iShares MSCI Europe Small-Cap ETF
2024-11-20,BLK,0.10058,0.747997,Neutral,IBIT Bitcoin ETF Options: All You Need to Know
2024-11-21,BLK,0.339343,0.61943,Somewhat-Bullish,Congressional Stock Purchase: Representative Debbie Wasserman Schultz Buys Viasat Stock | VSAT Stock News
2024-11-21,BLK,0.302833,0.645371,Somewhat-Bullish,Fixed Income: The argument for investing in bonds is the strongest it has been in years says Invesco's FI team
2024-11-22,BLK,0.381165,0.721871,Bullish,Cboe to Launch Bitcoin ETF-Linked Options in December
2024-11-22,BLK,0.11134,0.628567,Neutral,WestBridge Capital Offloads 2% Stake In Freshworks
2024-11-24,BLK,-0.447144,0.721329,Bearish,"BlackRock TCP Vs. Oaktree Specialty: Both Are Likely To Cut, One Of Them Sooner (OCSL)"
2024-11-25,BLK,0.312619,0.687493,Somewhat-Bullish,Palantir and Nvidia rank high on list of companies with rising sales estimates
2024-11-25,BLK,0.416452,0.747213,Bullish,How Bitcoin ETF Options Are Changing Crypto Trading
2024-11-25,BLK,0.147687,0.611757,Neutral,Advanced Micro Devices (AMD) Shifts to Unified UDNA Tech: AI Capabilities for Future Gaming GPUs
2024-11-26,BLK,0.399112,0.615007,Bullish,This ETF Has Returned 40% in 2024. Why It Can Beat the S&P 500 Again Next Year.
2024-11-26,BLK,-0.10167,0.621918,Neutral,‘The S&P 500 without the woke sh*t’: Here come the MAGA funds
2024-11-26,BLK,0.335261,0.94951,Somewhat-Bullish,"Long dominated by charismatic founders, Vanguard and SEI went outside for new bosses"
2024-11-27,BLK,-0.677335,0.977007,Bearish,"Texas AG Ken Paxton sues 3 major investors, accusing them of energy market manipulation"
2024-11-27,BLK,0.301365,0.910215,Somewhat-Bullish,ETFs: No One is Stealing iShares' Crown | Morningstar UK
2024-11-27,BLK,0.137098,0.649641,Neutral,Why Is Realty Income Corporation (O) Among the Best Dividend Aristocrats to Buy Now?
2024-11-28,BLK,0.322855,0.748058,Somewhat-Bullish,"Another Huge Week For Crypto! Key Developments For Bitcoin ETFs, XRP, Solana, And More"
2024-11-28,BLK,0.172593,0.622588,Somewhat-Bullish,Advanced Micro Devices (AMD) and Apple to Lead with TSM’s Advanced 2nm AI Chips in 2025
2024-11-29,BLK,0.237473,0.639085,Somewhat-Bullish,"Emerging Market Bulls Look Ready, But Bears Are Skeptical"
