date,ticker,sentiment,relevance,label,headline
2024-01-08,AAPL,0.147874,0.734993,Neutral,"FNGU ETF Analysis: Dividends, Returns AMEX:FNGU"
2024-01-09,AAPL,0.250695,0.584892,Somewhat-Bullish,Best Socially Responsible Investment Apps of January 2024
2024-01-11,AAPL,0.42099,0.710557,Bullish,"REX Shares and Tuttle Capital Management Expand T-REX Single-Stock ETF Suite with Apple, Alphabet, and Microsoft Offerings"
2024-01-11,AAPL,0.406746,0.908628,Bullish,Upcoming Events
2024-01-12,AAPL,0.10173,0.722841,Neutral,"Taiwan's strength in semiconductors could be its 'Achilles heel,' economist says"
2024-01-16,AAPL,-0.412647,1.0,Bearish,Supreme Court rejects Apple's appeal on App Store fees amid Epic Games legal battle
2024-01-16,AAPL,0.017666,0.567586,Neutral,"Microsoft Monetizing Copilot, Round 2; Synopsys Pays Big for Ansys"
2024-01-17,AAPL,0.007263,0.603853,Neutral,What Does 2024 Hold for the Magnificent Seven?
2024-01-17,AAPL,-0.087217,1.0,Neutral,Apple Inc. stock outperforms market despite losses on the day
2024-01-19,AAPL,-0.121222,0.649602,Neutral,Your S&P 500 Index Fund Has Higher Risk Than You May Think
2024-01-22,AAPL,0.317794,0.635806,Somewhat-Bullish,Higher S&P 500 Earnings Could Benefit This Active ETF
2024-01-26,AAPL,0.23632,0.634715,Somewhat-Bullish,AI & The Dragon: What Trends Will Dominate 2024?
2024-01-29,AAPL,-0.229964,0.639558,Somewhat-Bearish,XLK ETF: A Better Way To Invest In Microsoft But Volatility Comes First (NYSEARCA:XLK)
2024-01-29,AAPL,-0.334238,0.96001,Somewhat-Bearish,Apple Inc. stock underperforms Monday when compared to competitors
2024-01-30,AAPL,-0.498416,1.0,Bearish,Apple Inc. stock underperforms Tuesday when compared to competitors
2024-02-09,AAPL,0.123313,0.73272,Neutral,DLN: Large-Cap Monthly Dividend Payer Not So Hot
2024-02-12,AAPL,0.071362,0.642239,Neutral,Nvidia Overtakes Amazon in Market Value
2024-02-14,AAPL,0.238409,0.737323,Somewhat-Bullish,"Michael Burry Covers Bet Against Chips ETF, Buys Health and Tech Stocks"
2024-02-15,AAPL,0.138711,0.703988,Neutral,Stock market concentration is on the rise. Will this continue?
2024-02-15,AAPL,0.138561,0.729822,Neutral,YieldMax Magnificent 7 Fund of Option Income ETFs
2024-02-15,AAPL,0.18176,0.609473,Somewhat-Bullish,Relx Share Price Spiked Up 3% but Later Fell on FY 2023 Results
2024-02-16,AAPL,0.310248,0.741059,Somewhat-Bullish,"Here's How Much Money You'd Have if You Invested $7,000 in the ""Magnificent Seven"" in 2017"
2024-02-22,AAPL,0.13914,0.71212,Neutral,The Companies We’re Watching During Proxy-Voting Season 2024
2024-02-22,AAPL,0.411103,0.625311,Bullish,Dimensional ETFs and More: New on Syfe Custom Portfolio
2024-02-23,AAPL,0.620744,0.723078,Bullish,Episode #522: Wes Gray & Robert Elwood on How to Convert a Separately Managed Account (SMA) to an ETF
2024-02-24,AAPL,0.325606,0.739526,Somewhat-Bullish,How Nvidia grew to a trillion-dollar company fueling the AI revolution
2024-02-27,AAPL,0.11662,0.630013,Neutral,Moomoo Launches All-in-One Investment Super App in Malaysia; Empowering Local Financial Digitalisation
2024-02-28,AAPL,0.341658,0.605321,Somewhat-Bullish,NANC ETF Tracking Democrat Stock Trades Beating S&P 500 on Tech Bets
2024-02-28,AAPL,0.339357,0.70374,Somewhat-Bullish,A Wonderful Options-Based Dividend-Focused ETF?
2024-02-29,AAPL,0.134012,0.620405,Neutral,"Nvidia skyrocketed over the past 5 years, but 3 stocks performed even better—and none is Apple or Tesla"
2024-02-29,AAPL,0.524076,0.646742,Bullish,VONG ETF: A Great Way to Invest in Top Growth Stocks
2024-03-06,AAPL,-0.305759,0.728404,Somewhat-Bearish,Why Mega-Cap Tech Stocks’ Dominance Is a Risk
2024-03-06,AAPL,0.448739,0.606859,Bullish,How to Invest in Technology
2024-03-07,AAPL,0.344251,0.645972,Somewhat-Bullish,Should iShares Russell 1000 ETF (IWB) Be on Your Investing Radar?
2024-03-08,AAPL,0.329639,0.649593,Somewhat-Bullish,SCHX: As Cheap As It Gets For Large-Cap Exposure
2024-03-11,AAPL,0.00746,0.594185,Neutral,COPP Stock Price | Sprott Copper Miners ETF
2024-03-11,AAPL,0.106087,0.647039,Neutral,Alphabet is the bargain stock among the ‘Magnificent Seven’
2024-03-12,AAPL,-0.120796,0.627926,Neutral,"Forget Warren Buffett Stocks. Check Out What Todd Boehly Is Up to With RDE, Inc. [OTC: RSTN] Instead"
2024-03-12,AAPL,0.237856,0.606925,Somewhat-Bullish,Inverse/Leveraged Magnificent Seven ETFs Hit the Market
2024-03-12,AAPL,0.177163,0.79346,Somewhat-Bullish,3 Stocks to Buy Before the Fintech Sector Starts to Sizzle Again
2024-03-13,AAPL,-0.218899,1.0,Somewhat-Bearish,Will Warren Buffett Keep Selling Apple?
2024-03-14,AAPL,0.2205,0.749148,Somewhat-Bullish,"VGT ETF: High Growth, High Concentration (NYSEARCA:VGT)"
2024-03-14,AAPL,-0.315163,0.630091,Somewhat-Bearish,"Watch BofA’s Hartnett Sees Characteristics of a Bubble in Mag 7, Crypto"
2024-03-14,AAPL,-0.207913,0.748363,Somewhat-Bearish,"Markets Showing Signs of Bubble on Big Tech, Crypto Surge, BofA’s Hartnett Says"
2024-03-18,AAPL,0.333054,0.73213,Somewhat-Bullish,Options Bulls Resume Blitz on Alphabet Stock
2024-03-19,AAPL,0.102983,0.702897,Neutral,"Meta Bows Down to EU Regulations After Apple And Google, Cut Subscription Prices for Ad-Free Facebook and Instagram"
2024-03-19,AAPL,0.414956,1.0,Bullish,Apple Inc. stock outperforms competitors on strong trading day
2024-03-19,AAPL,-0.445625,0.619999,Bearish,BofA Survey Shows Risk-On Rotation Out of US Tech Into European Stocks
2024-03-21,AAPL,-0.403437,1.0,Bearish,Apple Loses $113 Billion in Value After Regulators Close In
2024-03-21,AAPL,0.310825,0.632874,Somewhat-Bullish,Impact Shares YWCA Women’s Empowerment ETF (WOMN) Reaches $50M in Assets Under Management
2024-03-22,AAPL,0.402316,0.582595,Bullish,Seeking a Growth ETF with Strong Returns? Check Out ILCG
2024-03-22,AAPL,0.344168,0.608498,Somewhat-Bullish,Get to know QQQ: Charting 25 years of performance
2024-03-23,AAPL,0.440311,0.618915,Bullish,"Wait, Did Europe Really Outperform the U.S. over the Last Three Years?"
2024-03-25,AAPL,0.249249,0.906795,Somewhat-Bullish,"Apple’s stock has faltered, but a Steve Jobs moment in AI may be on the horizon"
2024-03-26,AAPL,0.239102,0.722007,Somewhat-Bullish,FTEC: Concentration Increases Volatility (NYSEARCA:FTEC)
2024-03-28,AAPL,-0.116371,0.731812,Neutral,A new product allows 5x leveraged bets on the Magnificent Seven. Traders should be wary.
2024-04-03,AAPL,0.110386,0.648999,Neutral,Leading chipmaker TSMC evacuates staff and pauses some machinery after Taiwan's largest earthquake in a quarter-century
2024-04-08,AAPL,0.320381,0.617136,Somewhat-Bullish,"If I Could Only Buy and Hold 1 Vanguard ETF For the Next 5 Years, This Would Be My Top Pick"
2024-04-10,AAPL,-0.204729,0.552712,Somewhat-Bearish,Better Chip Stock: Marvell Technology vs. Qualcomm
2024-04-11,AAPL,0.229341,0.725076,Somewhat-Bullish,Fidelity Yield Enhanced Equity ETF Holdings
2024-04-17,AAPL,0.413832,0.70095,Bullish,"1 Stock-Split ETF That Could Turn $500 Per Month Into $1 Million, With Help From Nvidia, Microsoft, and Apple"
2024-04-18,AAPL,0.225039,0.633687,Somewhat-Bullish,Why Kartoon Studios (TOON) Shares Are Falling
2024-04-19,AAPL,-0.435065,1.0,Bearish,Apple Inc (AAPL) DCF Valuation: Is The Stock Undervalued?
2024-04-23,AAPL,0.225043,0.633201,Somewhat-Bullish,Big Monthly Dividends From Big Tech: JEPQ Vs. JEPI
2024-04-23,AAPL,0.347679,0.554585,Somewhat-Bullish,3 reasons the iShares S&P 500 ETF (IVV) is a great long-term investment
2024-04-25,AAPL,0.431445,0.992999,Bullish,Microsoft and Apple are safer bets than the U.S. government? Bond investors seem to think so.
2024-04-25,AAPL,0.125868,0.545191,Neutral,Imax Earnings: Dune 2 Boosts North American Market Share In Q1
2024-04-27,AAPL,0.309469,0.641443,Somewhat-Bullish,Why I Just Added This Ultra-High-Yield Dividend ETF to My Retirement Account
2024-04-29,AAPL,0.133552,0.51593,Neutral,How to Buy Roku Stock Online in 2021
2024-04-29,AAPL,0.118433,0.562817,Neutral,How to Buy Alphabet (Google) Stock Online in 2025
2024-05-03,AAPL,0.346294,0.735106,Somewhat-Bullish,"FTSE 100 back at record levels, Diageo gains on new CFO but IHG declines - Market Report"
2024-05-04,AAPL,-0.229747,0.719206,Somewhat-Bearish,Berkshire Hathaway operating earnings soar 39% as Buffett's cash hoard swells to record $188 billion
2024-05-06,AAPL,0.332662,0.717744,Somewhat-Bullish,Berkshire Hathaway Stock vs SPY: Which Is Best?
2024-05-07,AAPL,0.278075,0.618742,Somewhat-Bullish,2 Great Large-Cap ETFs
2024-05-08,AAPL,0.130497,0.716299,Neutral,Which Credit Bureau Stock Should You Buy for the Long-Term?
2024-05-08,AAPL,-0.114811,0.748344,Neutral,Can Crowding Scores Quantify US Stocks’ Fragility?
2024-05-09,AAPL,0.229375,0.693079,Somewhat-Bullish,Tech Stock Dividends Are Changing the Face of Dividend Growth Investing
2024-05-09,AAPL,0.336259,0.930451,Somewhat-Bullish,"Digital Map Market Size, Share with Focus on Emerging Technologies, Top Countries Data, Top Key Players Update, and Forecast 2029"
2024-05-14,AAPL,0.137943,0.733934,Neutral,3 Funds With Double-Digit Stakes in a Single Stock
2024-05-14,AAPL,0.403154,0.617606,Bullish,PNQI: I'm Buying This Tech Stock ETF Instead Of QQQ (NASDAQ:PNQI)
2024-05-15,AAPL,-0.229925,0.734004,Somewhat-Bearish,"Buffett's Berkshire reveals over $6B investment in Chubb, sending shares higher"
2024-05-15,AAPL,0.433101,1.0,Bullish,Apple’s Planning a $110B Stock Buyback. Here's Why. | Poole Thought Leadership
2024-05-17,AAPL,0.304262,0.655772,Somewhat-Bullish,"Regulatory Risks, Investment Sentiment and the India/Bharat Conundrum"
2024-05-18,AAPL,-0.318165,0.965757,Somewhat-Bearish,Opinion: Apple has lost its shine. Here’s what can help it regain luster.
2024-05-18,AAPL,0.346061,0.573133,Somewhat-Bullish,This Top Dow ETF Is Crushing the Nasdaq and the S&P 500 Over the Last Month. Here's What That Means for the Market Rally.
2024-05-20,AAPL,0.021559,0.705804,Neutral,FDLO: Low-Volatility ETF Beating Competitors
2024-05-20,AAPL,0.316389,0.721966,Somewhat-Bullish,This Might Just Be YieldMax’s Craziest ETF Yet (104.56% Dividend Yield)
2024-05-21,AAPL,0.557065,0.629941,Bullish,3 ETFs to Buy Now: May 2024
2024-05-21,AAPL,0.127361,0.617323,Neutral,Trump Media Stock Slides After Reporting $327.6M Q1 Loss
2024-05-23,AAPL,-0.128972,0.73611,Neutral,Live Nation Entertainment Stock Tumbles as DOJ Announces Antitrust Suit
2024-05-23,AAPL,0.341283,0.737243,Somewhat-Bullish,TSMC sees annual sales growth to reach 10% in semiconductor industry
2024-05-23,AAPL,0.122158,0.668003,Neutral,Vivek Ramaswamy spent $3.3 million to buy 8% of BuzzFeed. How much damage could he do with that stake?
2024-05-31,AAPL,0.197036,0.641192,Somewhat-Bullish,TCW Transform 500 ETF Review and Aggregate Rating (VOTE)
2024-06-04,AAPL,0.129016,0.613961,Neutral,5 things you need to know before nvidia's stock split.
2024-06-05,AAPL,0.114326,0.638804,Neutral,Arm aims to win 50% of PC market in five years: Haas
2024-06-05,AAPL,0.327525,0.634127,Somewhat-Bullish,The 3 Best ETFs to Buy in June 2024
2024-06-06,AAPL,0.108089,0.93255,Neutral,Nvidia overtakes Apple as No. 2 most valuable company
2024-06-06,AAPL,0.109256,0.608069,Neutral,Is Life360 still an opportunity after shares have surged?
2024-06-07,AAPL,0.147497,0.722611,Neutral,What to Know Heading into FTSE Russell’s 36th Annual Russell Reconstitution
2024-06-10,AAPL,0.031486,0.729535,Neutral,Who are the highest-paid S&P 500 CEOs of 2023?
2024-06-12,AAPL,0.141231,0.701071,Neutral,Ozempic Maker Novo Nordisk Closes In On Lego As Denmark's Most Valuable Brand: Report
2024-06-13,AAPL,0.452462,1.0,Bullish,Apple reigns again as most valuable U.S. company for first time since January
2024-06-14,AAPL,0.30131,0.724981,Somewhat-Bullish,Semiconductors Hit Record Highs As Industry Reaches $6.3 Trillion: 5 Chip Stocks That Outpaced Nvidia This Week
2024-06-17,AAPL,0.316977,0.749816,Somewhat-Bullish,Trade the AI Trend With This Pair of Leveraged ETFs
2024-06-17,AAPL,0.203035,0.784307,Somewhat-Bullish,Trade the AI Trend With This Pair of Leveraged ETFs
2024-06-17,AAPL,0.285257,0.631176,Somewhat-Bullish,3 Great Funds for the Class of 2024
2024-06-17,AAPL,0.323353,0.626131,Somewhat-Bullish,Trade the AI Trend With This Pair of Leveraged ETFs
2024-06-18,AAPL,-0.21335,0.743628,Somewhat-Bearish,Nvidia surpasses Microsoft to become the world’s most valuable company
2024-06-18,AAPL,0.204536,0.693572,Somewhat-Bullish,Nvidia becomes world’s most valuable company amid AI boom
2024-06-18,AAPL,0.128023,0.707212,Neutral,Nvidia eclipses Microsoft as world's most valuable company
2024-06-18,AAPL,0.133086,0.928057,Neutral,Nvidia set to overtake Apple in $72 billion technology ETF shakeup after its monster 164% rally this year
2024-06-18,AAPL,0.212975,0.919799,Somewhat-Bullish,A major tech ETF is set to load up on Nvidia at the expense of Apple
2024-06-18,AAPL,-0.128125,0.615797,Neutral,"Nvidia Becomes Most Valuable Public Company, Topping Microsoft (Published 2024)"
2024-06-19,AAPL,-0.417918,0.711067,Bearish,"Nvidia Beats Apple, Microsoft to Become Most Valuable Company On Earth"
2024-06-19,AAPL,0.341133,0.644689,Somewhat-Bullish,Nvidia beats Microsoft to become world's most valuable company
2024-06-19,AAPL,0.079128,0.721592,Neutral,"Nvidia becomes world’s most valuable company, dethroning Microsoft"
2024-06-20,AAPL,0.28512,0.63775,Somewhat-Bullish,3 ETFs to Watch as Tech Looks Unlikely to Slow Down
2024-06-21,AAPL,0.270556,0.739108,Somewhat-Bullish,How Nvidia surpassed Microsoft and Apple to become world’s most valuable company
2024-06-23,AAPL,0.239629,0.634162,Somewhat-Bullish,"IWF Is a Great Choice for Most, But I Like VUG ETF Better"
2024-06-27,AAPL,0.244631,0.601415,Somewhat-Bullish,The Case for Investing in a Capital Appreciation ETF
2024-06-27,AAPL,0.332318,0.640846,Somewhat-Bullish,Why Blue Chips Are Ripe for Growth Investing
2024-06-27,AAPL,0.420458,0.616295,Bullish,What’s the Secret Sauce in this High-Income Fund?
2024-06-27,AAPL,-0.135591,0.858218,Neutral,A Shakeup for Technology ETFs
2024-06-28,AAPL,0.024134,0.558393,Neutral,"Fumble! Your Favorite NFL Team Is On The Hook For $450 Million In Sunday Ticket Lawsuit, 1.76x More Than Player Pay In 2024"
2024-07-01,AAPL,0.240556,0.749443,Somewhat-Bullish,Active investing is suited to the uncertain markets ahead
2024-07-10,AAPL,0.174517,0.791162,Somewhat-Bullish,Best Metaverse ETFs
2024-07-11,AAPL,0.308705,0.648871,Somewhat-Bullish,Value investors cooling their heels as growth stocks stay hot
2024-07-14,AAPL,0.034685,0.638312,Neutral,BTCZ Stock Price | T-Rex 2X Inverse Bitcoin Daily Target ETF
2024-07-15,AAPL,0.307521,0.61425,Somewhat-Bullish,"Buffett's Berkshire Hathaway sets, closes at record high"
2024-07-15,AAPL,0.321769,0.61236,Somewhat-Bullish,AES Corp (AES) August 16 puts purchased as share price down 9.5%
2024-07-16,AAPL,0.117091,0.63369,Neutral,The AI Revolution Continues
2024-07-16,AAPL,0.416235,1.0,Bullish,Apple at all-time high after Morgan Stanley calls stock 'top pick' for AI efforts
2024-07-18,AAPL,0.426793,0.593658,Bullish,TSMC second-quarter profit beats expectations as AI chip boom continues
2024-07-18,AAPL,-0.104421,0.727521,Neutral,Can Value Stocks Really Make a Comeback?
2024-07-24,AAPL,-0.440725,0.611233,Bearish,This Vanguard ETF Is Tumbling as Big Tech Stocks Sink
2024-07-25,AAPL,0.104249,0.60035,Neutral,Check out OneStream's stock price (OS) in real time
2024-07-25,AAPL,-0.336857,0.929487,Somewhat-Bearish,Apple Vision Pro Launches New Lake-Setting Environment For Digital Crown VR
2024-07-30,AAPL,-0.211636,0.71317,Somewhat-Bearish,"Buffett cuts Bank of America stake, sales top $3 bln"
2024-08-09,AAPL,0.331702,0.627861,Somewhat-Bullish,Should Vanguard Russell 1000 Growth ETF (VONG) Be on Your Investing Radar?
2024-08-10,AAPL,0.026563,0.631115,Neutral,VFQY: A Diversified But Underperforming Quality ETF
2024-08-12,AAPL,0.327412,0.613934,Somewhat-Bullish,3 Principal Financial Group Mutual Fund for Strong Returns
2024-08-13,AAPL,0.315381,1.0,Somewhat-Bullish,"Apple Stock Is Gaining Momentum, Is AAPL Stock a Buy?"
2024-08-13,AAPL,0.141095,0.617853,Neutral,Growth Beats Yield at This T. Rowe Price Mutual Fund
2024-08-15,AAPL,0.302228,0.644338,Somewhat-Bullish,IUSG: A Growth ETF With An Impressive 12% IRR Potential (NASDAQ:IUSG)
2024-08-15,AAPL,-0.457113,0.928659,Bearish,"Berkshire invests in Ulta Beauty, Heico as it retreats from Apple"
2024-08-15,AAPL,-0.412324,0.736381,Bearish,Berkshire Hathaway Takes Stake in Ulta Beauty
2024-08-15,AAPL,0.070842,0.924322,Neutral,"Warren Buffett Still Holds 400M Apple Shares, Reveals New Investments In Ulta Beauty And Heico — Elon Musk Calls Berkshire Hathaway's $277B Cash Reserves 'Wild'"
2024-08-21,AAPL,0.260528,0.636805,Somewhat-Bullish,AI Stock Eyes Early Buy Trigger As Profits Surge
2024-08-22,AAPL,0.321391,0.614411,Somewhat-Bullish,"Amplify CWP Growth & Income ETF ETF Price, Holdings, & News (NYSEARCA:QDVO)"
2024-08-22,AAPL,0.140244,0.740488,Neutral,Amplify CWP Growth & Income ETF Holdings
2024-08-23,AAPL,0.021105,0.768926,Neutral,QDVO Top Holdings List & Exposure (Amplify CWP Growth & Income ETF)
2024-08-24,AAPL,0.123941,0.73552,Neutral,Will Alphabet (GOOG) AI Phones Crush Apple’s AI Plans?
2024-08-24,AAPL,0.33717,0.746737,Somewhat-Bullish,Best Dividend ETFs for 2024
2024-08-26,AAPL,0.31717,0.649038,Somewhat-Bullish,Stay Flexible With the AI Trade With These 2 ETFs
2024-08-27,AAPL,0.012403,0.803899,Neutral,3 Dividend-Growth Stocks That a Top-Rated Vanguard Fund Manager Likes
2024-08-27,AAPL,-0.1421,0.620794,Neutral,Immersion Stock Surges as It Monetizes Haptic Technology Patents
2024-08-28,AAPL,0.223467,0.626137,Somewhat-Bullish,Smart Home Automation Companies | Forecast by 2033
2024-08-28,AAPL,-0.083665,0.744978,Neutral,Berkshire Just Crossed $1 Trillion. Is It a Buy?
2024-08-29,AAPL,0.119905,0.713896,Neutral,Warren Buffett's Berkshire Hathaway is Worth $1 Trillion. Should I Buy Shares?
2024-09-12,AAPL,0.044407,0.672148,Neutral,Should TCW Transform 500 ETF (VOTE) Be on Your Investing Radar?
2024-09-18,AAPL,0.107287,0.591792,Neutral,Macquarie Group mulls $2.3b stake sale in UK’s Wavenet: Bloomberg
2024-09-19,AAPL,0.32057,0.600635,Somewhat-Bullish,MUSQ Global Music Industry ETF Celebrates Its One-Year Anniversary on the New York Stock Exchange
2024-09-20,AAPL,0.01609,0.71985,Neutral,"Politan prevails in Masimo proxy fight, gaining 2 board seats and ousting CEO Joe Kiani"
2024-09-21,AAPL,0.327091,0.627321,Somewhat-Bullish,Is the iShares Russell 1000 Growth ETF a Millionaire Maker?
2024-09-23,AAPL,0.112478,0.735888,Neutral,Amkor Falls 18% in 3 Months: How Should Investors Play the Stock?
2024-09-23,AAPL,0.345245,0.63875,Somewhat-Bullish,Capturing the in vogue ‘mega-forces’ in a one-stop ETF shop
2024-09-23,AAPL,0.126148,0.721742,Neutral,Should Motley Fool 100 Index ETF (TMFC) Be on Your Investing Radar?
2024-09-24,AAPL,0.117773,0.646933,Neutral,The Marygold Companies Secures Private Placement to Finance Next-Stage Rollout Initiatives for Recently Developed Fintech Product
2024-09-24,AAPL,-0.197198,0.98937,Somewhat-Bearish,"Apple unexpectedly fell on rebalancing day, who is the culprit?"
2024-09-24,AAPL,0.148696,0.718378,Neutral,Hello Group: Undervalued With Expertise In App Development Makes It Attractive
2024-09-26,AAPL,0.326299,0.774128,Somewhat-Bullish,"InterDigital, IBD Stock Of The Day, Flirts With Buy Point After Analyst Day"
2024-09-30,AAPL,0.200082,0.613636,Somewhat-Bullish,Goldman Sachs Reiterates Buy Rating on Jabil (JBL)
2024-10-17,AAPL,-0.132334,0.602015,Neutral,Warren Buffett Pick Breaks Out: IBD Stock Of The Day
2024-10-17,AAPL,0.074631,0.630524,Neutral,"iShares Top 20 U.S. Stocks ETF ETF Price, Holdings, & News (NYSEARCA:TOPT) $TOPT"
2024-10-17,AAPL,0.234536,0.579645,Somewhat-Bullish,"How much money you'd have now if you invested $1,000 in Netflix 10 years ago"
2024-10-18,AAPL,0.13322,0.643521,Neutral,State Street Corp's Strategic Acquisition of John Wiley & Sons Inc Shares
2024-10-18,AAPL,0.209419,0.70623,Somewhat-Bullish,Which AI Stocks Are Leading the Market to New Highs?
2024-10-18,AAPL,0.307646,0.603352,Somewhat-Bullish,"Why this money manager sees FirstService, Novo Nordisk and Microsoft as good long-term holdings"
2024-10-20,AAPL,-0.301731,0.603615,Somewhat-Bearish,"XMAG ETF Analysis: Dividends, Returns NASDAQ:XMAG"
2024-10-20,AAPL,-0.111889,0.704581,Neutral,XMAG Stock Fund Price and Chart — NASDAQ:XMAG
2024-10-21,AAPL,0.340541,0.737918,Somewhat-Bullish,MAGS: An Efficient Way To Invest In The Magnificent Seven (NASDAQ:MAGS)
2024-10-22,AAPL,0.107332,0.608124,Neutral,Google Parent Stock Sinks as OpenAI Launches AI-Powered Browser ChatGPT Atlas
2024-10-22,AAPL,0.026047,0.747417,Neutral,XMAG ETF: What to Know About the New Anti-Mag 7 Fund
2024-10-24,AAPL,0.103642,0.646332,Neutral,Ingram Micro IPO: Major tech product distributor debuts on NYSE today after pricing its stock within target range
2024-10-25,AAPL,0.799531,0.927155,Bullish,"If you invested $10,000 in Apple, Nvidia, or these 8 other stocks in 1999, you'd have over $1 million now"
2024-10-25,AAPL,0.11676,0.759107,Neutral,TTEQ Top Holdings List & Exposure (T. Rowe Price Technology ETF)
2024-10-25,AAPL,0.106471,0.73093,Neutral,Clear Harbor Asset Management's Strategic Reduction in Intellicheck Holdings
2024-10-26,AAPL,0.135634,0.930927,Neutral,Nvidia overtakes Apple as world's most valuable company
2024-10-28,AAPL,0.121757,0.715746,Neutral,Worried About the Magnificent 7? This New S&P 500 Fund Excludes Them
2024-10-28,AAPL,0.110665,0.902137,Neutral,How Nvidia Overtook Apple as World's Most Valuable Company
2024-10-29,AAPL,0.271655,0.601831,Somewhat-Bullish,3 Top Dividend ETFs That Could Build Generation-Spanning Wealth
2024-10-30,AAPL,0.302797,0.720793,Somewhat-Bullish,Fidelity MSCI Information Technology Index ETF Holdings
2024-10-30,AAPL,0.329957,0.726915,Somewhat-Bullish,Vanguard Information Technology ETF: 3 Reasons Why Investors Need to Own VGT Right Now
2024-10-31,AAPL,0.331014,0.713443,Somewhat-Bullish,iShares Core S&P Total U.S. Stock Market ETF Holdings
2024-10-31,AAPL,-0.14243,0.59001,Neutral,BlackRock launches ETF that expands beyond the ‘Magnificent Seven'
2024-10-31,AAPL,0.325883,0.709188,Somewhat-Bullish,Dimensional US High Profitability ETF Holdings
2024-10-31,AAPL,-0.216299,0.720491,Somewhat-Bearish,BlackRock launches ETF that expands beyond the ‘Magnificent Seven'
2024-10-31,AAPL,0.143585,0.603731,Neutral,T. Rowe Price PM a ‘big believer’ in crypto
2024-11-01,AAPL,-0.270278,1.0,Somewhat-Bearish,"Apple Earnings: Our Valuation Rises to Reflect Stronger Long-Term Growth, but Less of an AI Impact"
2024-11-15,AAPL,-0.224999,0.723939,Somewhat-Bearish,"Berkshire bites into Domino's Pizza, dips into Pool amid stock retreat"
2024-11-15,AAPL,0.33313,0.60058,Somewhat-Bullish,Palantir Stock Rises as It Shifts Listing To Nasdaq
2024-11-15,AAPL,-0.254721,0.740834,Somewhat-Bearish,"Berkshire bites into Domino's Pizza, dips into Pool as stock retreat"
2024-11-16,AAPL,0.514164,1.0,Bullish,Chilton Investment Co LLC Boosts Stake in Apple Inc
2024-11-18,AAPL,-0.213391,0.635999,Somewhat-Bearish,FBY: One Of My Favorite Santa's Income Plays
2024-11-19,AAPL,0.413194,0.608902,Bullish,Kurv Investment Management Completes Reorganization of Yield Premium Suite to Proprietary Trust
2024-11-19,AAPL,0.23371,0.707724,Somewhat-Bullish,Wearable Devices Ltd. Unveils Mudra Band and Mudra Link: Revolutionary Neural Wristband Technology for Gesture Control
2024-11-19,AAPL,0.465311,0.713763,Bullish,The Smartest Megacap Growth ETF to Buy With $500 Right Now
2024-11-19,AAPL,0.339719,0.853123,Somewhat-Bullish,Fidelity High Dividend ETF Holdings
2024-11-20,AAPL,0.305966,0.56515,Somewhat-Bullish,VOOG vs. SCHG: Which Is the Better Growth Stock ETF?
2024-11-20,AAPL,0.118739,0.854178,Neutral,Global X NASDAQ 100 Covered Call ETF Holdings
2024-11-21,AAPL,0.44654,0.711064,Bullish,Under the Hood of Fidelity’s Blue Chip Growth
2024-11-21,AAPL,0.338143,0.692005,Somewhat-Bullish,Under the Hood of Fidelity’s Blue Chip Growth ETF
2024-11-21,AAPL,0.102319,0.773507,Neutral,America eats the world
2024-11-22,AAPL,0.132547,0.604365,Neutral,ICLV: Value With Some Tech Exposure (NYSEARCA:ILCV)
2024-11-23,AAPL,0.328439,0.64826,Somewhat-Bullish,Here's How Much You Would Need to Invest in This Unstoppable Vanguard ETF Today to Grow Your Portfolio to $1 Million or More by Retirement
2024-11-23,AAPL,-0.246916,0.82319,Somewhat-Bearish,"Billionaire Warren Buffett Pours $752,000,000 Into New Assets After Dumping Apple, Bank of America"
2024-11-26,AAPL,-0.242083,0.739924,Somewhat-Bearish,Google faces £7 billion UK class action lawsuit over search engine dominance
2024-11-26,AAPL,0.138084,0.622991,Neutral,"Best Buy broadly misses earnings estimates as consumers pull back on appliances, electronics"
2024-11-26,AAPL,0.323047,0.641387,Somewhat-Bullish,The S&P 500 is expected to return 10% in 2025
2024-11-27,AAPL,0.134891,0.727089,Neutral,The S&P 500 (SPY) Is Ready for a Sell-Off
2024-11-28,AAPL,0.37067,0.808043,Bullish,Advanced Micro Devices (AMD) and Apple to Lead with TSM’s Advanced 2nm AI Chips in 2025
2024-11-30,AAPL,-0.309071,0.701013,Somewhat-Bearish,‘Small caps are going to become more in favor in 2025': VettaFi’s research head doubles down on winning group
2024-11-30,AAPL,-0.142724,0.615841,Neutral,2 no-brainer Warren Buffett stocks to buy into 2025
2024-12-23,AAPL,0.413915,1.0,Bullish,Apple approaches $4 trillion valuation as investors bet on AI momentum
2024-12-23,AAPL,0.406848,1.0,Bullish,Apple to see strong Christmas iPhone sales that launch a ‘renaissance of growth’
2024-12-24,AAPL,0.311561,0.704193,Somewhat-Bullish,Globalstar director James Monroe III buys $985k in stock By Investing.com
2024-12-27,AAPL,-0.260254,1.0,Somewhat-Bearish,Apple’s been on an uncommonly strong run. So a tough January could now be in the cards.
2024-12-29,AAPL,0.130553,1.0,Neutral,"Jim Cramer on Apple Inc. (AAPL): ‘It Was The Dumb Money That Was Getting Out, Because Warren Buffett Or One Of His Assistants Made Us Nervous’"
